cluster_no,link,content
Health & General,b'https://www.nutrition-and-you.com/mango-fruit.html',king fruits mango fruit one popular nutritionally rich fruits unique flavor fragrance taste heath promoting qualities making numero uno among new functional foods often labeled super fruits mango one delicious seasonal fruits grown tropics tree believed originating sub himalayan plains indian subcontinent botanically exotic fruit belongs family anacardiaceae family also includes numerous species tropical fruiting trees flowering plants cashew pistachio scientific name mangifera indica adsbygoogle window adsbygoogle push mango tropical tree cultivated many regions india farming extended wide across world many continents flowering fruits grow end long string like peduncle sometimes one fruit peduncle fruit measures cms length cms width typical mango shape sometimes oval round weight ranges g around g outer skin pericarp smooth green un ripe mangoes turns ripe fruits golden yellow crimson red yellow orange red depending upon cultivar type fresh mango season lasts april august mango comes different shapes sizes depending upon cultivar types internally flesh mesocarp juicy orange yellow color numerous soft fibrils radiating centrally placed flat oval shaped stone enveloping single large kidney shaped seed flavor pleasant rich tastes sweet mild tartness high quality mango fruit feature less fiber composition minimal tartness mango seed stone may either single embryo sometimes polyembryonic mango fruit rich pre biotic dietary fiber vitamins minerals poly phenolic flavonoid antioxidant compounds according new research study mango fruit found protect colon breast leukemia prostate cancers several trial studies suggest polyphenolic antioxidant compounds mango known offer protection breast colon cancers mango fruit excellent source vitamin flavonoids like carotene carotene cryptoxanthin g fresh fruit provides iu g recommended daily levels vitamin together compounds known antioxidant properties essential vision vitamin also required maintaining healthy mucosa skin consumption natural fruits rich carotenes known protect lung oral cavity cancers fresh mango good source potassium g fruit provides mg potassium mg sodium potassium important component cell body fluids helps controlling heart rate blood pressure also excellent source vitamin b6 pyridoxine vitamin c vitamin e consumption foods rich vitamin c helps body develop resistance infectious agents well scavenge harmful oxygen free radicals vitamin b pyridoxine required gaba hormone production within brain also controls homocysteine levels within blood may otherwise harmful blood vessels resulting coronary artery disease cad stroke composes moderate amounts copper copper co factor many vital enzymes including cytochrome c oxidase superoxide dismutase minerals function co factors enzyme manganese zinc copper also required production red blood cells additionally mango peel also rich phytonutrients pigment antioxidants like carotenoids polyphenols adsbygoogle window adsbygoogle push see table depth analysis nutrients mangos seasonal fruits fresh mango fruit season begins march end rich fragrance heralds arrival markets mangoes usually harvested green perfectly matured unripe ones extremely sour taste organic mangoes left ripen tree however ripe fruits fall tree tend get spoiled store mangoes come various sizes colors therefore select one based serving size variety fruit love devour alphonso variety india maharashtra state sindhuri kesar varieties pakistan known uniqueness totapuri mangoes feature parrot beak shape tips smooth shiny come attractive green yellow orange colors totapuri varieties best eaten raw short full ripe stage pulp features pleasant blend sweet tart taste special mint clove like flavor depending cultivars several us cultivars hayden hybrids also equally popular choose ones intact skin without bruises cuts unripe mangoes kept room temperature days ripen keep paper covers ripe fruits stored refrigerator never f c bring back normal temperature fruit eaten get natural taste flavor wash mangoes cold running water order remove dust dirt surface chemical residue mop dry outer skin using soft cloth mango fruit eaten alone without seasonings additions experience rich flavor cut fruit lengthwise three pieces way middle portion consists husky seed slice skin separate skin pulp chop pulp desired sections alternatively using sharp knife cut flesh either side central seed stone way get two big halves mango fruit central stone portion take one half score flesh horizontal vertical pattern taking care cut deep skin invert whole half push cubes shown picture serving tips fresh mango cubes great addition fruit salads mango juice ice cubes popular delicious drink mango fruit juice blended milk mango milkshake mango fruit also used prepare jam jelly ice cream sweet candy industries unripe raw green mango use preparation pickles jam marmalade chutney asian countries mango fruit avoided diet individuals warfarin therapy mangoes high vitamin could result potentiation warfarin activity may cause increased bleeding risk reference link food lifestyle interactions warfarin mango latex allergy especially raw unripe mangoes common sensitized individuals immediate reactions may include itchiness angle mouth lips tip tongue people reactions severe manifestations like swelling lips ulceration mouth angles respiratory difficulty vomiting diarrhea reaction develops anacardic acid present raw unripe mangoes cross allergic reactions anacardiaceae family fruits like cashew apples quite common events may rarity completely ripe fruits however people known case mango fruit allergy may want avoid eating medical disclaimer adsbygoogle window adsbygoogle push mango fruit excellent source vitamin carotene pigments vitamins potassium mango fruit avoided diet individuals warfarin therapy allergic manifestations eating raw unripe mango common back fruits mango fruit visit impressive list variety fruits complete illustrations nutrition facts health benefits back home page resources mangifera indica agroforestry net usda nutrient database standard reference mangoes national mango board food lifestyle interactions warfarin sitemapupdated apr copyright umesh rudrappa rights reserved home us contact blog sitemap privacy policy disclaimer
Mango Languages,b'https://www.mymcpl.org/research-and-learning/research-databases/mango-languages',mcpl locations closed notice learn mcpl response covid virtual branch available mango online language learning system focuses teaching actual conversation skills wide variety languages lesson combines real life situations audio native speakers easy follow interface simple clear instructions mango also uses fully interactive feature films help users master new languages mango offers languages including chinese french german hebrew japanese spanish mango languages available android ios page helpful yes mid continent public library rights reserved powered f
Health & General,b'https://www.bbc.com/news/magazine-35461265',share withemailfacebookmessengermessengertwitterpinterestwhatsapplinkedincopy linkthese external links open new windowfifty years ago china plunged chaotic traumatic decade recent history cultural revolution period nation gripped peculiar hysteria mania mangoes benjamin ramm discovers fruit became object deep veneration vehicle promotion cult chairman mao mao called student red guards rebel reactionary authorities aim reshape society purging bourgeois elements traditional ways thinking summer country become engulfed fighting red guard factions competed power quell forces unleashed mao sent workers qinghua university beijing armed talisman little red book students attacked spears sulphuric acid killing five injuring finally surrendering mao thanked workers gift approximately mangoes given previous day pakistan foreign minister huge impact one northern china point knew mangoes workers stayed night looking smelling caressing wondering magical fruit says art historian freda murck chronicled story detail time received high directive chairman mao saying henceforth working class must exercise leadership everything exciting given kind recognition power shift zealous students workers peasants offered respite anarchy people beijing told perceived mao finally intervened chaotic random violence mangoes symbolised end cultural revolution murck says bbc historyzhang kui worker occupied qinghua says arrival one mao mangoes workplace prompted intense debate military representative came factory mango raised hands discussed whether split among us eat preserve finally decided preserve says found hospital put formaldehyde made specimen first decision second decision make wax mangoes wax mangoes glass cover made wax replicas gave one revolutionary workers workers expected hold sacred fruit solemnly reverently admonished failed wang xiaoping employee beijing machine tool plant received wax replica fruit destined higher things real mango driven worker representative procession beating drums people lining streets factory airport says wang workers chartered plane fly single mango factory shanghai one mangoes began rot workers peeled boiled flesh vat water became holy worker sipped spoonful mao said chuckled hearing particular detail beginning mango gift took relic like quality revered even worshipped says cambridge university lecturer adam yuet chau mango gift chairman chairman association reflected poem period seeing golden mango seeing great leader chairman mao standing golden mango like standing beside chairman mao touching golden mango golden mango warm smelling mango golden mango fragrant mangoes toured length breadth country hosted series sacred processions red guards wrecked temples shrines destroying artefacts easier erasing religious behaviour soon mangoes became object intense devotion rituals imitated centuries buddhist daoist traditions mangoes even placed altar factory workers would bow china long history symbolic associations food may encouraged extravagant interpretations mao gift mangoes compared mushrooms immortality longevity peach chinese mythology workers surmised mao gift act selflessness sacrificed longevity little know disliked fruit concerned learn mao simply passing gift already received tradition china zhuansong gifting may regarded vulgar west china gifting widely seen compliment enhancing status giver recipient mangoes also proved gift propaganda department communist party quickly manufactured mango themed household items bed sheets vanity stands enamel trays washbasins well mango scented soap mango flavoured cigarettes massive papier mache mangoes appeared central float national day parade beijing october far away guizhou province thousands armed peasants fought black white photocopy mango everybody enthusiastic fruit artist zhang hongtu told scepticism mango story published newspaper thought funny stupid ridiculous never mango knew fruit fruit rot expressed doubts however severely punished village dentist publicly humiliated executed comparing touring mango sweet potato mango fever fizzled months soon discarded wax replicas used candles electrical outages visit beijing imelda marcos took case philippine national fruit mangoes gift hosts mao wife jiang qing known madame mao west tried replicate earlier enthusiasm sending mangoes workers dutifully held ceremony gave thanks jiang qing lacked husband sense political timing following year mao lay ill clear successor sight commissioned new film song mango enhance credibility within week release jiang arrested film taken circulation final chapter mango story listen mao golden mangoes bbc radio friday february gmt catch later bbc iplayer mangoes common fruit beijing wang xiaoping buy golden mango juice whenever likes mystery mango gone tells longer sacred icon become another consumer good young people know history us lived every time think mangoes heart special feeling mao like mangoes gave workers lies preserved wax crystal glass case historians tended regard mango craze bizarre fad one occasions culture created spontaneously bottom initiated interpreted workers period great cruelty mangoes represented people emblem peace generosity wanted believe promise written enamel trays mango profound kindness subscribe bbc news magazine email newsletter get articles sent inbox guidelines opening america outline three stages us states ease lockdowns sayings around world
Health & General,b'https://www.thebodyshop.com/en-us/collection/mango/c/c00097',use cookies information cookie policy follow link closing message continuing browse site agreeing use cookies browser logged product title quantity product quantity minibasket promo sign today first hear exclusive offers events fields marked arerequired30 self care essentials free shipping orders see updates covid 19free shipping orders sign today first hear exclusive offers events fields marked arerequired30 self care essentials free shipping orders see updates covid 19free shipping orders product title quantity product quantity minibasket promo india mango known symbol love enjoy fruity fresh aroma mango body mist lip butter mango scrub mango body butter mango shower gel soap free contains real mango seed oil mango body oil made community trade marula oil india mango known symbol love enjoy fruity fresh aroma mango body mist lip butter mango scrub mango body butter mango shower gel soap free contains real mango seed oil mango body oil made community trade marula oil match products please try another search productsthis product stock already added maximum allowed quantity bag happy contact soon item available simply enter email address space privacy policy email saved happy contact soon item available thank interest contact email item requested becomes available sign today first hear exclusive offers events fields marked arerequired9am 10pm estmonday saturdaypublic holidays closed1 97469am 10pm estmonday saturdaypublic holidays closed1 body shop international limited registered trademark body shop international limited trademark body shop international limited rights reserved body shop international limited registered trademark body shop international limited trademark body shop international limited rights reserved
Business,b'https://www.mangosmexicancafe.com/',west main street mesa az 5700homeorder onlinemenulocationmore44 west main street mesa az 5700monday saturday 10am 9pmdesign limon mediathe best homemade mexican food north rio grande mangos mexican caf serves wide variety mexican foods recipes heart mesa arizona purpose simply provide great tasting high quality mexican foods beverages fun friendly atmosphere brightly colored cheerfully decorated eatery fun casual place food comes fast fresh mangos mexican cafe relax family friends enjoying fun flavors mexico mangos mexican caf located old town mesa west main street mesa arizona information please call open monday saturday pm hours subject change without notice forget ask catering west main street mesa az
Health & General,b'https://github.com/bigdatagenomics/mango',github home million developers working together host review code manage projects build software together use git checkout svn using web url want notified new releases bigdatagenomics mango nothing happens download github desktop try go backif nothing happens download github desktop try go backif nothing happens download xcode try go backif nothing happens download github extension visual studio try go backmango scalable genomics visualization tool built top adam genomics processing engine apache licensed mango consists notebook browser form factor allowing users visualize reads variants features gui programmable interface mango tools use pileup js interactive scrolling genomic loci mango documentation hosted readthedocs documentation mango includes instructions running mango notebook mango browser locally remotely cloud amazon emr google cloud engine documentation also provides python api documentation mango notebook mango tools published maven central corresponding python modules published pypi readthedocs provides instructions install mango tools recent distribution instructions running mango tools source found readthedocs need maven installed order build mango mango browser also requires npm note default configuration hadoop building different version hadoop please edit build configuration properties section pom xml file using mango notebook recommend setting virtual environment install required python modules configure python environment mango notebook refer instructions building python mango notebook set python apis jupyter widgets loading manipulating genomic data jupyter notebook environment mango apis used loading visualizing raw features variants alignments well calculating viewing aggregate information mango also run notebook form jupyter ui navigate example files notebooks view example notebooks stated mango notebook provides python apis loading visualizing genomic data jupyter notebook environment api information mango notebook found readthedocs mango documentation includes instructions running mango notebook amazon aws instructions leveraged visualize genomic datasets staged amazon s3 include example notebooks exploring genomes dataset amazon s3 using mango docker instances example notebook found github mango documentation includes instructions running mango notebook google cloud engine instructions leveraged visualize genomic datasets staged publically using mango docker instances example notebook found github mango browser provides gui visualize genomic data stored remotely cloud mango browser uses intervalrdds perform fast indexed lookups interval keyed data mango packaged via appassembler includes necessary dependencies mango repository includes example scripts run mango browser small example files run example files mango browser run see demonstration chromosome region view mango genomics browser localhost port specified help launching script run bin mango submit hthe mango documentation includes instructions running mango browser amazon aws instructions leveraged visualize genomic datasets staged amazon s3 mango widgets standalone jupyter widgets interacting pileup js jupyter notebook environment api documentation mango widgets found readthedocs
Health & General,b'https://nuts.com/driedfruit/mango/organic.html',continue shopping looking almonds cashews walnuts organic qty 1our organic dried mango naturally sweet rich vibrant simply mango additives sweeteners source sweetest choicest mango cheeks could find pieces large delicious organic mango peeled cut hand peak ripeness really taste difference oh bit harder chew careful worth organic dried mango healthy option satisfying sweet tooth delivers rich source dietary fiber makes delicious tropical fruit satisfying snack keeps feeling full supports digestive system organic mango packaged facility peanuts tree nuts soy milk products serving size 40g oz store open closed refrigeration year item frozen approximately pieces per pound country origin mexicoid 1502kosher gluten free kosher pareve certified gluten free organic sugar added sulphur dioxide superfoods working around clock get orders door quickly possible safety always top priority mind suspending return refund process indefinitely whatever takes make right
Health & General,b'https://www.hillsboroughcounty.org/locations/mango-recreation-center',jump center hours outside areas sunrise sunsetthis recreation center park two basketball courts two softball fields lights along playground equipment recreation center rooms rent along school summer camp programs youth acre dog park also location provide website feedback e kennedy blvd tampa fl
Mango Languages,b'https://multcolib.org/resource/mango-languages',language learners use resource create account mango languages keep track learning simply logon guest
Health & General,b'https://www.britannica.com/plant/mango-plant-and-fruit',editors review submitted determine whether revise article mango mangifera indica member cashew family anacardiaceae one important widely cultivated fruits tropical world mango tree considered indigenous eastern asia myanmar burma assam state india mangoes rich source vitamins c tree evergreen often reaching metres feet height attaining great age simple leaves lanceolate cm inches long flowers small pinkish fragrant borne large terminal panicles loose clusters stamens pistils others stamens fruit varies greatly size character form oval round heart shaped kidney shaped long slender smallest mangoes larger plums others may weigh kg pounds varieties vividly coloured shades red yellow others dull green single large seed flattened flesh surrounds yellow orange colour juicy distinctive sweet spicy flavour mango require particular soil finer varieties yield good crops well marked dry season stimulate fruit production rainy areas fungal disease known anthracnose destroys flowers young fruits difficult control propagation grafting budding inarching approach grafting scion stock independently rooted plants grafted scion later severed original stock widely practiced tropical asia tedious relatively expensive florida efficient methods veneer grafting chip budding developed used commercially mango inextricably connected folklore religious ceremonies india buddha presented mango grove might find repose grateful shade name mango fruit known english spanish speaking countries likely derived malayam manna portuguese adopted manga came kerala spice trade probably difficulty transporting seeds retain viability short time tree introduced western hemisphere planted brazil reached west indies
