cluster_no,link,content
Brand,b'https://shop.mango.com/us',shopping bag empty xyour shopping bag updatedthe items added last session included
Health & General,b'https://en.wikipedia.org/wiki/Mango',mango juicy stone fruit drupe produced numerous species tropical trees belonging flowering plant genus mangifera cultivated mostly edible fruit species found nature wild mangoes genus belongs cashew family anacardiaceae mangoes native south asia common mango indian mango mangifera indica distributed worldwide become one widely cultivated fruits tropics mangifera species e g horse mango mangifera foetida grown localized basis worldwide several hundred cultivars mango depending cultivar mango fruit varies size shape sweetness skin color flesh color may pale yellow gold orange mango national fruit india pakistan national tree bangladesh unofficial national fruit philippines english word mango plural mangoes mangos originated malayalam word mangga via dravidian tamil mankay man mango tree kay fruit maangaay spice trade period south india 15th 16th centuries earliest known reference cultivation mangoes traced india 2000bce mango brought east asia around bce 15th century philippines 16th century africa brazil portuguese explorers several verified accounts novels references mango fruit indian tamil literary works prominent known reference mango fruit 5th century saint karaikkal ammaiyar mentioned received mango fruit boon lord shiva due devotion husband requested providing alms one two mangoes given husband earlier ascetic disguised lord shiva mango mentioned hendrik van rheede dutch commander malabar region book hortus malabaricus plants economic value mangoes first imported american colonies 17th century pickled lack refrigeration fruits also pickled came called mangoes especially bell peppers 18th century word mango became verb meaning pickle mango trees grow ft tall crown radius ft trees long lived specimens still fruit years deep soil taproot descends depth ft profuse wide spreading feeder roots anchor roots penetrating deeply soil leaves evergreen alternate simple cm long cm broad leaves young orange pink rapidly changing dark glossy red dark green mature flowers produced terminal panicles cm long flower small white five petals mm long mild sweet fragrance varieties mangoes known many ripen summer give double crop fruit takes four five months flowering ripen ripe fruit varies according cultivar size shape color sweetness eating quality depending cultivar fruits variously yellow orange red green fruit single flat oblong pit fibrous hairy surface separate easily pulp fruits may somewhat round oval kidney shaped ranging centimetres length grams oz kilograms lb weight per individual fruit skin leather like waxy smooth fragrant color ranging green yellow yellow orange yellow red blushed various shades red purple pink yellow fully ripe ripe intact mangoes give distinctive resinous sweet smell inside pit mm thick thin lining covering single seed cm long mangoes recalcitrant seeds survive freezing drying mango trees grow readily seeds germination success highest seeds obtained mature fruits mango tree full bloom kerala closeup inflorescence immature fruits alphonso mango tree mangoes cultivated south asia thousands years reached southeast asia fifth fourth centuries bce 10th century ce cultivation begun east africa 14th century moroccan traveler ibn battuta reported mogadishu cultivation came later brazil bermuda west indies mexico appropriate climate allows growth mango cultivated frost free tropical warmer subtropical climates almost half world mangoes cultivated india alone second largest source china mangoes also grown andalusia spain mainly laga province coastal subtropical climate one places mainland europe permits growth tropical plants fruit trees canary islands another notable spanish producer fruit cultivators include north america south florida california coachella valley south central america caribbean hawai south west central africa australia china south korea pakistan bangladesh southeast asia though india largest producer mangoes accounts less international mango trade india consumes production many commercial cultivars grafted cold hardy rootstock gomera mango cultivar originally cuba root system well adapted coastal mediterranean climate many mango cultivars easily cultivated using grafted saplings ranging turpentine mango named strong taste turpentine bullock heart dwarf semidwarf varieties serve ornamental plants grown containers wide variety diseases afflict mangoes many hundreds named mango cultivars mango orchards several cultivars often grown order improve pollination many desired cultivars monoembryonic must propagated grafting breed true common monoembryonic cultivar alphonso important export product considered king mangoes cultivars excel one climate may fail elsewhere example indian cultivars julie prolific cultivar jamaica require annual fungicide treatments escape lethal fungal disease anthracnose florida asian mangoes resistant anthracnose current world market dominated cultivar tommy atkins seedling haden first fruited southern florida initially rejected commercially florida researchers growers importers worldwide embraced cultivar excellent productivity disease resistance shelf life transportability size appealing color although tommy atkins cultivar commercially successful cultivars may preferred consumers eating pleasure alphonso generally ripe mangoes orange yellow reddish peel juicy eating exported fruit often picked underripe green peels although producing ethylene ripening unripened exported mangoes juiciness flavor fresh fruit global production mangoes report includes mangosteens guavas million tonnes led india million tonnes world total see table china thailand next largest producers table wholesale level price mangoes varies according size variety factors fob price reported united states department agriculture mangoes imported us ranged approximately us average low price average high price per box kg box mangoes generally sweet although taste texture flesh varies across cultivars alphonso soft pulpy juicy texture similar overripe plum others tommy atkins firmer like cantaloupe avocado fibrous texture skin unripe pickled cooked mango eaten potential cause contact dermatitis lips gingiva tongue susceptible people hedgehog style form mango preparation glass mango juice sliced ataulfo mangoes mango chutney mangoes widely used cuisine sour unripe mangoes used chutneys pickles dhals side dishes bengali cuisine may eaten raw salt chili soy sauce summer drink called aam panna comes mangoes mango pulp made jelly cooked red gram dhal green chillies may served cooked rice mango lassi popular throughout south asia prepared mixing ripe mangoes mango pulp buttermilk sugar ripe mangoes also used make curries aamras popular thick juice made mangoes sugar milk consumed chapatis pooris pulp ripe mangoes also used make jam called mangada andhra aavakaaya pickle made raw unripe pulpy sour mango mixed chili powder fenugreek seeds mustard powder salt groundnut oil mango also used andhra pradesh make dahl preparations gujaratis use mango make chunda spicy grated mango delicacy mangoes used make murabba fruit preserves muramba sweet grated mango delicacy amchur dried powdered unripe mango pickles including spicy mustard oil pickle alcohol ripe mangoes often cut thin layers desiccated folded cut bars similar dried guava fruit bars available countries fruit also added cereal products muesli oat granola mangoes often prepared charred hawaii unripe mango may eaten bagoong especially philippines fish sauce vinegar soy sauce dash salt plain spicy dried strips sweet ripe mango sometimes combined seedless tamarind form mangorind also popular mangoes may used make juices mango nectar flavoring major ingredient ice cream sorbetes mango used make juices smoothies ice cream fruit bars raspados aguas frescas pies sweet chili sauce mixed chamoy sweet spicy chili paste popular stick dipped hot chili powder salt main ingredient fresh fruit combinations central america mango either eaten green mixed salt vinegar black pepper hot sauce ripe various forms pieces mango mashed used topping ice cream blended milk ice milkshakes sweet glutinous rice flavored coconut served sliced mango dessert parts southeast asia mangoes pickled fish sauce rice vinegar green mangoes used mango salad fish sauce dried shrimp mango condensed milk may used topping shaved ice energy value per g oz serving common mango kj kcal apple mango slightly higher kj kcal per g fresh mango contains variety nutrients right table vitamin c folate significant amounts daily value respectively numerous phytochemicals present mango peel pulp triterpene lupeol basic research potential biological effects mango peel pigments study include carotenoids provitamin compound beta carotene lutein alpha carotene polyphenols quercetin kaempferol gallic acid caffeic acid catechins tannins mango contains unique xanthonoid called mangiferin phytochemical nutrient content appears vary across mango cultivars different carotenoids isolated mango pulp densest beta carotene accounts yellow orange pigmentation mango cultivars mango leaves also significant polyphenol content including xanthonoids mangiferin gallic acid pigment euxanthin known indian yellow often thought produced urine cattle fed mango leaves practice described outlawed malnutrition cattle possible urushiol poisoning supposed origin euxanthin appears rely single anecdotal source indian legal records outlaw practice flavor mango fruits constituted several volatile organic chemicals mainly belonging terpene furanone lactone ester classes different varieties cultivars mangoes flavor made different volatile chemicals volatile chemicals different quantities general new world mango cultivars characterized dominance carene monoterpene flavorant whereas high concentration monoterpenes z ocimene myrcene well presence lactones furanones unique feature old world cultivars india alphonso one popular cultivars alphonso mango lactones furanones synthesized ripening whereas terpenes flavorants present developing immature ripening fruits ethylene ripening related hormone well known involved ripening mango fruits causes changes flavor composition mango fruits upon exogenous application well contrast huge amount information available chemical composition mango flavor biosynthesis chemicals studied depth handful genes encoding enzymes flavor biosynthetic pathways characterized date contact oils mango leaves stems sap skin cause dermatitis anaphylaxis susceptible individuals history contact dermatitis induced urushiol allergen found poison ivy poison oak poison sumac may risk mango contact dermatitis mango compounds potentially responsible dermatitis allergic reactions mangiferin resinous acid mangiferic acid resinol mangiferol cross reactions may occur mango allergens urushiol sensitized individuals may able safely eat peeled mangos drink mango juice mango trees flowering spring local people allergies may experience breathing difficulty itching eyes facial swelling even flower pollen becomes airborne case irritant likely vaporized essential oil flowers primary ripening season mangoes contact mango plant parts primarily sap leaves fruit skin common cause plant dermatitis hawaii mango national fruit india pakistan philippines also national tree bangladesh india harvest sale mangoes march may annually covered news agencies mango traditional context culture south asia edicts mauryan emperor ashoka references planting fruit shade bearing trees along imperial roads roads banyan trees caused planted order might afford shade cattle men mango groves caused planted medieval india indo persian poet amir khusrow termed mango naghza tarin mewa hindustan fairest fruit hindustan mangoes enjoyed court delhi sultan alauddin khijli mughal empire especially fond fruits babur praises mango babarnameh sher shah suri inaugurated creation chaunsa variety victory mughal emperor humayun mughal patronage horticulture led grafting thousands mangoes varieties including famous totapuri first variety exported iran central asia akbar said planted mango orchard trees lakhi bagh darbhanga bihar jahangir shah jahan ordered planting mango orchards lahore delhi creation mango based desserts jain goddess ambika traditionally represented sitting mango tree mango blossoms also used worship goddess saraswati mango leaves used decorate archways doors indian houses weddings celebrations ganesh chaturthi mango motifs paisleys widely used different indian embroidery styles found kashmiri shawls kanchipuram silk sarees tamil nadu mango referred one three royal fruits along banana jackfruit sweetness flavor triad fruits referred pala vazhai classical sanskrit poet k lid sa sang praises mangoes mangoes popularized china cultural revolution symbols chairman mao zedong love people mango illustrated michael boym book flora sinensis nearly ripened purple mango israel e khuda mango grown pakistan mango roundabout rajshahi bangladesh banganpalli mangoes sold guntur mangos paris farmers market
Health & General,b'https://www.mangohealth.com/',mango health helps manage medicine create healthy habits savor moments matter los angeles timesselffast company
Health & General,b'https://www.healthline.com/nutrition/mango',parts world mango mangifera indica called king fruits drupe stone fruit means large seed middle mango native india southeast asia cultivated years hundreds types mango unique taste shape size color fruit delicious also boasts impressive nutritional profile fact studies link mango nutrients health benefits improved immunity digestive health eyesight well lower risk certain cancers overview mango nutrition benefits tips enjoy mango low calories full nutrients one cup grams sliced mango provides also contains small amounts phosphorus pantothenic acid calcium selenium iron one cup grams mango provides nearly rdi vitamin c water soluble vitamin aids immune system helps body absorb iron promotes growth repair mango packed polyphenols plant compounds function antioxidants dozen different types including mangiferin catechins anthocyanins quercetin kaempferol rhamnetin benzoic acid many others antioxidants important protect cells free radical damage free radicals highly reactive compounds bind damage cells research linked free radical damage signs aging chronic diseases amongst polyphenols mangiferin gained interest sometimes called super antioxidant since especially powerful test tube animal studies found mangiferin may counter free radical damage linked cancers diabetes illnesses mango good source immune boosting nutrients one cup grams mango provides daily vitamin needs vitamin essential healthy immune system helps fight infections meanwhile getting enough vitamin linked greater infection risk top amount mango provides nearly three quarters daily vitamin c needs vitamin help body produce disease fighting white blood cells help cells work effectively improve skin defenses mango also contains folate vitamin k vitamin e several b vitamins aid immunity well mango contains nutrients support healthy heart instance offers magnesium potassium help maintain healthy pulse blood vessels relax promoting lower blood pressure levels mango also contains unique antioxidant called mangiferin animal studies found mangiferin may protect heart cells inflammation oxidative stress apoptosis controlled cell death addition may lower blood cholesterol triglycerides free fatty acid levels findings promising research mangiferin heart health humans currently lacking therefore studies needed recommended treatment mango several qualities make excellent digestive health one contains group digestive enzymes called amylases digestive enzymes break large food molecules easily absorbed amylases break complex carbs sugars glucose maltose enzymes active ripe mangoes sweeter unripe ones moreover since mango contains plenty water dietary fiber may help solve digestive problems like constipation diarrhea one four week study adults chronic constipation found eating mango daily effective relieving symptoms condition supplement containing similar amount soluble fiber indicates mango components aside dietary fiber aid digestive health mango full nutrients help support healthy eyes two key nutrients antioxidants lutein zeaxanthin accumulate retina eye part converts light brain signals brain interpret seeing especially core macula inside retina lutein zeaxanthin act natural sunblock absorbing excess light addition appear protect eyes harmful blue light mangoes also good source vitamin supports eye health lack dietary vitamin linked dry eyes nighttime blindness severe deficiencies cause serious issues corneal scarring mango high vitamin c promotes healthy hair skin vitamin essential making collagen protein gives structure skin hair collagen gives skin bounce combats sagging wrinkles additionally mango good source vitamin encourages hair growth production sebum liquid helps moisturize scalp keep hair healthy vitamin retinoids migrate skin protect sun aside vitamins c mango high polyphenols function antioxidants antioxidants help protect hair follicles damage oxidative stress mango high polyphenols may anticancer properties polyphenols help protect oxidative stress linked many types cancer test tube animal studies found mango polyphenols reduced oxidative stress stopped growth destroyed various cancer cells including leukemia cancer colon lung prostate breast mangiferin major polyphenol mango recently gained attention promising anticancer effects animal studies reduced inflammation protected cells oxidative stress either stopped growth cancer cells killed studies promising human studies needed better understand mango polyphenols anticancer effects people mango delicious versatile easy add diet however difficult cut due tough skin large pit good idea cut long vertical slices inch millimeters away middle separate flesh pit next cut flesh grid like pattern scoop rind ways enjoy mango keep mind mango sweeter contains sugar many fruits moderation key best limit mango two cups grams per day mango rich vitamins mineral antioxidants associated many health benefits including potential anticancer effects well improved immunity digestive eye skin hair health best tasty easy add diet part smoothies dishes mangoes tropical fruit many health benefits learn help maintain healthy weight improve digestion eating fruit boost health help prevent disease healthiest fruits earth backed science mango popular fruit whose skin commonly removed eating though argue consumed instead tossed article fruits nutritious contain lots fiber antioxidants however people think harmful sugar enjoy nutritional benefits mango healthy salad soup snack recipes detailed article dried fruit health effects dried fruit nutritious also contains lot sugar calories many tropical fruits full vitamins minerals nutrients help boost health fight disease nine worth tracking article reviews many servings fruit eat per day fruit nutritious healthy people worried sugar soluble fiber may benefit digestion gut bacteria blood sugar levels foods packed soluble fiber fruit healthy choice eat throughout pregnancy benefits ideas add fruit diet
Health & General,b'https://www.mangoperu.com/',authentic peruvian nestled downtown washington avenue loft district mango peruvian cuisine features upscale loft style environment chic comfort come together melding delicious food warm hospitality relaxed inviting come enjoy signature crafted libation bar quiet romantic dinner two book large table friends pleasure welcome jorge calvo orders musts eligible delivery delivery eligible addresses within miles establishment st louis friends know restaurants st louis area currently provide dine service loyal customers however still come get delicious food ordering carryout bring new delivery services check special carryout delivery menu give us call jorge calvo mango team homeaboutmenucontacteventsmore phone 9993opentable com1001 washington ave saint louis mo63101mon thur 11am 10pmfri sat 11am 11pmsunday 4pm 9pmemail info com
Health & General,b'https://www.facebook.com/mango.com/',last weeks produced white gowns healthcare workers hangar design center barcelona possible thanks people staff collaboration pablo horstmann foundation non profit organisation acquired metres approved fabric distribute gowns among hospitals nursing homes centres people disabilities according vulnerability need thank everyone battling covid every day helping supporting others important ever mangotogethercharity auction remember exclusive dress sof nchez de betak wore last edition met gala organised charitable campaign support decins sans fronti res fight covid global pandemic unique designs experiences artworks donated friends like mango leandra medine andr saraiva among others auction start tomorrow april 32auctions com alittlesomething check mangotogether stayhome
Health & General,b'http://ric.uthscsa.edu/mango/',mango short multi image analysis gui viewer medical research images provides analysis tools user interface navigate image volumes three versions mango geared different platform designed developed jack l lancaster ph michael j martinez list known publications used mango image processing found support mango software development provided part icbm grant p01 eb01955 nih nimh brainmap grant r01 mh074457 nih nimh support software development provided mango grant r01 eb015314 01a1 nih nibib
Health & General,b'https://mangosalon.com/',deliver amazing salon experience toour guests every time keep coming back mangorva
Health & General,b'https://www.mangomoney.com/',earn annual percentage yield mango savings manage send money mobile device mango financial inc rights reserved customer agreements avoid account fraudby using card agree terms conditions cardholder agreement fee schedule mango prepaid mastercard issued metropolitan commercial bank member fdic pursuant license mastercard international metropolitan commercial bank metropolitan registered trademarks metropolitan commercial bank card program marketed administered praxell inc important information opening card account help federal government fight funding terrorism money laundering activities usa patriot act requires financial institutions third parties obtain verify record information identifies person opens card account means open card account ask name address date birth information allow us identify may also ask see driver license identifying documents use card subject funds availability fees terms conditions apply see cardholder agreement details trademarks service marks registered marks properties respective owners annual percentage yield advertised may apply portion savings balance monthly signature purchase requirements apply see savings feature customer agreement additional details standard message data rates wireless service provider may apply see fee schedule cardholder terms conditions rate accurate october discretion may change interest rate savings feature may change interest rate savings feature time customer service call praxell inc mango money 2036important notice mango sent documents email mango savings account holders received interest payments least received please check spam folder confirm email address correct receive please send email last digits card number first name last name complete phone number address zip code last digits ssn verification purposes mangosupport com call
Brand,b'https://www.mangooutlet.com/us/women',shopping bag empty xyour shopping bag updatedthe items added last session included
Health & General,b'http://mangomaterials.com/',scientific innovation meets environmental justice mango materials rights reserved
Health & General,b'http://ric.uthscsa.edu/mango/mango.html',mango supports mac windows linux operating systems download mac v4 download windows v4 download linux v4 download previous versions mac v4 windows v4 linux v4 mac v4 windows v4 linux v4 mac v3 windows v3 linux v3 mac v3 windows v3 linux v3 mac v3 windows v3 linux v3 mac v3 windows v3 linux v3 mac v3 windows v3 linux v3 mac v3 windows v3 linux v3 mac v3 windows v3 linux v3 mac v3 windows v3 linux v3 mac v3 windows v3 linux v3 mac v2 windows v2 linux v2 mac v2 windows v2 linux v2 mac v2 windows v2 linux v2 mango software copyrighted university texas mango available use free charge educational scientific non commercial purposes software data derived mango software may used research may used clinical purposes mango software data derived mango software used scientific publications request research imaging institute uthscsa cited reference use incorporation software data derived software commercial applications commercial publications requires written consent rii uthscsa rii uthscsa makes representations warranties suitability software either express implied including limited implied warranties merchantability fitness particular purpose non infringement conformance specification standard rii uthscsa shall liable damages suffered licensee result using modifying software derivatives install plugin download plugin file convenient location desktop folder rename plugin file open plugin manager options menu toolbox use add plugin button select downloaded plugin file file moved plugin directory remove plugin use plugin manager options menu toolbox application need restarted order remove plugin use list plugins submitted users found forum
Health & General,b'https://www.youtube.com/user/mangoFashion',sign like videos comment subscribe loading loading loading working loading loading loading loading working loading playlists
