cluster_no,link,content
Health & General,b'https://www.medicalnewstoday.com/articles/275921',mangoes sweet creamy fruits range possible health benefits highly popular around world mango member drupe family type plant food fleshy outer section surrounds shell pit pit contains seed olives dates coconuts also part family many different kinds mango vary color shape flavor seed size although mango skin green red yellow orange inner flesh mostly golden yellow feature part collection articles health benefits popular foods article explore many benefits mangoes explain nutritional breakdown provide healthful recipe ideas consuming mangoes help protect strengthen body several ways sections discuss benefits detail mangoes contain antioxidant called zeaxanthin review suggests zeaxanthin may play protective role eye health could prevent damage macular degeneration eye condition gets worse age review cites anti inflammatory properties zeaxanthin possible cause protective mechanism study japan found carotenoid containing fruits vegetables mangoes may reduce risk colon cancer also skin cancer foundation suggest diet high beta carotene content help protect skin cancer orange fruits vegetables mangoes contain beta carotene also suggest boost action immune system disease mouse study mango leaves found plant compounds powerful effect risk factors diabetes included lower body weight reduced blood sugar levels lower levels fats blood study clarify whether mango flesh provides benefits however one study found eating freeze dried mangoes reduced blood sugar levels people obesity fiber potassium vitamin content mangoes help keep arteries working reduce risk heart disease increasing potassium decreasing sodium diet among important dietary changes person make reduce risk high blood pressure mangoes also support hair health provide good amount vitamin nutrient helps skin provide oily substance called sebum moisturizes hair vitamin also necessary growth bodily tissues including skin hair one cup sliced mango provides milligrams mg vitamin c person daily requirement according dietary guidelines americans consuming enough vitamin c supports development maintenance collagen provides structure skin hair one gram g cup sliced raw mango provides mangoes good source vitamins minerals contribute heavily daily requirement several nutrients including mangoes also contribute copper calcium iron diet well antioxidants zeaxanthin beta carotene best judge ripeness mango color people look fresh mangoes yield slightly touch ripe mangoes black freckles skin continue ripen room temperature reach ideal ripeness best store plastic bag refrigerator longer days mangoes taste best slightly chilled eaten straight tree one best ways enjoy fresh mango dicing eating without extra ingredients options include alternatively people try following recipe black bean burgers chipotle mango guacamole provides combination plant based proteins complex carbs additional antioxidant boost use following ingredients make wholesome plant burgers preparationthe following ingredients add mango punch flavorsome meal preparationpeople allergy latex may cross reaction mangoes people try adopt well rounded varied diet provides access broad range nutrients rather focusing benefits one particular fruit vegetable mangoes similar guavas terms nutritional content mangoes like guavas tropical fruit provide beta carotene carbohydrates sugar guavas otherwise guavas beat mangoes nutrient categories cup serving g gauvas g fiber twice much magnesium six times vitamin c times potassium times lycopene faced choice guavas mangoes choose guavas nutrient dense fruit bananas may help lower blood pressure reduce risk developing cancer find nutrients bananas provide get tips antioxidants mostly found plant foods natural molecules help neutralize harmful free radicals bodies free radicals discover potential health benefits pineapple source essential vitamins minerals thiamin riboflavin vitamin b folate eating variety fruits important fruits better others people diabetes fresh frozen fruits better well balanced diet draw food groups find food group get tips healthful diet
Health & General,b'https://www.mangolive.com/',mango used control maintain aspects organisation qhse compliance requirements whatever needs health safety quality environmental management food safety four mango answer mango used control maintain aspects organisation qhse compliance requirements whatever needs health safety quality environmental management food safety four mango answer broaden qhse knowledge resources skill levels whether need latest advanced tactics refresher basics start scratch home qhse knowledge watch listen mango clients like wrestling qhse compliance tell stories using mango tell like download free integrated management system manual use manual help implementation qhse system meets requirements annex sl iso iso iso iso iso iso mango bums seats licence pay monthly fee locked long term contract help mango partner start using mango within days get started sign organisations rely mango qhse compliance come different shapes sizes clients located across united kingdom australia new zealand south africa see mango helped cb traffic solutions manage compliance requirements certifications iso iso gives assurance manage quality information security certificates download supercharge consulting company growth building new recurring revenue stream delivering value clients mango sets apart competitors cloud question mango also future industry mango tool bag able give clients easier cost effective way tackling compliance obligations find click
Health & General,b'https://www.flymango.com/',important latest information travel updates coronavirus covid visit https sacoronavirus co za mango newsroomwelcome mango gives choice flexibility pay mango flights including taxes extras using saa voyager miles enough saa voyager miles cover cost fare worry pay difference forms payment credit card cash nedbank greenbacks edgars account card important rules regulations saa voyager members redeem saa voyager miles mango yet able earn saa voyager miles mango minimum saa voyager miles needed book mango flight addition mango redeems saa voyager miles denominations miles therefore rounded nearest denomination voyager works denominations might note differences availability booking total save miles recalculate miles booking totalno saa voyager benefits additional baggage upgrades lounge access applicable using saa voyager miles pay mango flight standard saa voyager mango terms conditions apply online payments enquiries assistance please contact mango call centre welcome successfully logged clubmiles member multiply discount annual flight limit reached change flight date additional admin feemore bettermango flies east london r479
Health & General,b'https://www.nypl.org/collections/articles-databases/mango-languages',learn new language interactive database provides step step lesson plans different languages database features esl lessons arabic cantonese mandarin french german greek italian japanese korean brazilian portuguese polish russian spanish turkish vietnamese speakers text translator provided download mobile app first time users must create profile order access resource patrons read terms conditions privacy policy resource searching new york public library 2020the new york public library c ein
Health & General,b'https://loopymango.com/',still accepting shipping online orders cropped fisherman cardigan available big cotton merino diy kits brand new yarn colors well individual patterns month april pattern proceeds donated meals heroes non profit organization working support medical professionals small businesses nyc get ready spring perfect chunky cable sweater knit cotton big cotton yarn available purchase includes knitting patterns beautiful photography knitting tutorials loopy mango story quick linksvisit store500 main st beacon ny 2476for safety community store closed notice still accepting online orders shippingfree shipping domestic orders international 200newsletter
Health & General,b'https://apps.apple.com/us/app/mango-languages/id443516516',app available app store iphone ipad download mango app learn new language go hands free features offline accessibility prepare business trips family vacations study abroad practical conversation based language lessons start try first lesson language free comprehensive course units learn vocabulary pronunciation grammar culture simultaneously interactive words phrases plus cultural insights popular features linguist approved language courses content aligned international standards native speaker audio individualized review system interactive listening reading exercises essential cultural insights bluetooth syncing auto play go learning pre downloadable lessonsavailable courses english speakers arabic egyptian arabic iraqi arabic levantine arabic modern standard armenian azerbaijani bengali chinese cantonese chinese mandarin croatian czech cherokee danish dari dutch dzongkha filipino tagalog finnish french french canadian german greek greek ancient greek koine haitian creole hawaiian hebrew modern hebrew biblical hindi hungarian icelandic indonesian igbo irish italian japanese javanese kazakh korean latin malay malayalam norwegian pashto persian farsi polish portuguese brazilian punjabi pakistani romanian russian scottish gaelic serbian slovak spanish latin american spanish castilian swahili swedish tamil telugu thai turkish tuvan ukrainian urdu uzbek vietnamese yiddishavailable english courses english arabic egyptian speakers english arabic modern standard speakers english armenian speakers english bengali speakers english chinese cantonese speakers english chinese mandarin speakers english french speakers english german speakers english greek speakers english haitian creole speakers english hmong speakers english italian speakers english japanese speakers english korean speakers english polish speakers english portuguese brazilian speakers english russian speakers english somali speakers english spanish latin american speakers english turkish speakers english vietnamese speakersget full access want learn get full access courses linking profile library institution offers mango near purchasing subscription languages auto renewable monthly subscription languages single language auto renewable monthly subscription single language question comment feel free contact us support com follow facebook https www facebook com mangolanguageson twitter https twitter com mangolanguageson instagram https www instagram com mangolanguageson youtube https www youtube com mangolanguagesterms use https mangolanguages com legal terms conditions itunes account automatically charged confirmation purchase renewal price original subscription within hours scheduled end date current payment period subscription may managed going user account settings purchase auto renewal feature also turned account settings subscription canceled access app courses features expire end current payment period unused portion free trial period offered forfeited user cancels changes subscription questions comments support comversion 0check new tutorials expect challenge listening reading activities daily review 8k ratingsi using mango app help learn spanish really like ability pronunciation phrases repeated want hear something easy app includes lot repetition good learning new vocabulary grammar seems right amount grammatical exclamation explanations clear concise would suggest two improvements first wish pages included text indicators whether one speaking formally informally using plural singular using particular adjective describe masculine feminine object clear english translation one turn narrator voice include information means taking time get item narrator includes introductory phrase page even information needed example would say second would useful app could variation recombinations examples exact example appears would useful variations using vocabulary one already learned understand however would add production cost app perhaps require larger file sizes native speaker recordings would created stored overall though useful app learning languages hola thanks rating review happy enjoying learning mango excellent suggestions first including information explained narrator using text graphics great idea second suggestion always working new material courses keep eye additions spanish course future really appreciate suggestions passed feedback along developers comments us future please let us know support comthis first language learning app arabic come across teaches colloquial arabic well msa major props want able speak people get started learning arabic constructing sentences start conversing right away much effective random vocabulary might use learning makes think sentence needs constructed build vocabulary natural way love able record speaking language recorded language like private tutor get skip around learn want instead tutor thinks learn helpful keeping engaged include short vowels writing well clueless say specific words dialect warning app teach read arabic learn quick jump take week learn alphabet learned though pronounce reading natural way app well worth money save dollars books apps get app love learning languages limited one language either good luck absolutely love mango especially option show literal nonliteral translation phrase also love able download lessons wide variety languages offer never seen scottish gaelic offered platform really cool also nice clear audio though wish sometimes distinguish dialects use audios suggestion regards phonetic approximations words phrases really wish ipa option even committed linguists much better ipa versions showing exact pronunciations rather anglicized approximations many languages sounds found english make much sense always use approximations use ipa good thing care matter love mini ipa course would someday offered since app language focused anyway still importantly would love added ipa option phonetics latha math thank taking time review mango really appreciate feedback happy answer questions dialects native speakers courses write us support com addition also sharing interest ipa options mini course available within mango linguists like learn suggestions please hesitate email kellyrequires ios later compatible iphone ipad ipod touch english spanishwith family sharing set six family members use app
Business,b'http://www.mangoii.com/',mother day may 12th 4pm 30pmfather day june 4pm 30pm
Health & General,b'https://twitter.com/mango?lang=en',detected javascript disabled browser would like proceed legacy twitter yeswe inspire unite people passion style culture sure want view tweets viewing tweets unblock last weeks produced gowns healthcare workers hangar design center barcelona collaboration pablo horstmann foundation thank everyone battling covid every day mangotogetherpic twitter com quviqghcaybeing together key must part within capacity next days donating million masks hospitals spain find letter ceo mangotogether stayhomepic twitter com 0ynhddx9mc iwd2020 womensday mangotogether mangopic twitter com tvzosdj1qvss20 key items bag http mng us 3qiq50yezp8 sandals http mng us w4xr50yezpa mangoss20 mangopic twitter com vkr39jw3aoss20 key items semiprecious stone necklace http mng us pwvh50ydyho mangoss20 mangopic twitter com mtfctpaer7ss20 key items sandals http mng us cff350ychbj bag http mng us tq1b50ychbi mangoss20 mangopic twitter com y1nhpuy4nlshared moments ss20 campaign discover full story http mng us oulu50yyedg mangotogether mangoss20 mangopic twitter com eyvpnobjxqshared moments ss20 campaign discover full story http mng us oulu50yyedg mangotogether mangoss20 mangopic twitter com lqnrtbufdxshared moments ss20 campaign discover full story http mng us erqs50yyedi mangotogether mangoss20 mangopic twitter com fyjlm1zpapshared moments ss20 campaign https youtu kqqmgtg5aq8 photography video glen luchford styling lodie david touboul casting anna ewers rebecca leigh longendyke vittoria ceretti kit butler hamid onifade mangotogether mangoss20 mangoit suits beyond office conquer meetings ahead whatever week got office tonal outfits combined staples special accessories discover collection http mng us fhus50ywdj6 mangoss20 mangopic twitter com spwe5tcn2pdenim starring edie campbell iconic cool denim timeless fabric reinvented remain wardrobe staple discover collection http mng us 4v2a50yp7ng mangoss20 mangopic twitter com leyymmva3mdenim starring edie campbell iconic cool denim timeless fabric reinvented remain wardrobe staple discover collection http mng us 4v2a50yp7ng mangoss20 mangopic twitter com ajnhrd7hnr 3d printed jewels introducing first 3d printed jewellery capsule collection made sustainable materials biodegradable plant based plastics woods ceramics discover innovative collection http mng us cvcx50ykuhe mangoss20 mangopic twitter com e6xtddqmcj 3d printed jewels introducing first 3d printed jewellery capsule collection made sustainable materials biodegradable plant based plastics woods ceramics discover innovative collection http mng us cvcx50ykuhe mangoss20 mangopic twitter com ze7uoxtg87 3d printed jewels introducing first 3d printed jewellery capsule collection made sustainable materials biodegradable plant based plastics woods ceramics discover innovative collection http mng us 748450ykuhg mangoss20 mangopic twitter com prcvcpbighsunset conversation introduce next preferred style one fluid clean also creates dialogue statement pieces classy ones black n white mangoss20 mangopic twitter com khx0cwhosfan accessory level look literally blink eye try something bold trendy bucket hat retro scarf realize best effortlessly http www mango com mangoss20 mangopic twitter com qryhcxvwz3best basics blazer coat discover http mng us nla350y8o4d mangoss20 mangopic twitter com wbtbem5h9anew winter garden blouse http mng us jdhd50y2vrl skirt http mng us zjao50y2vrk mangoss20 mangopic twitter com 9l6eu0zpyp tweeted yet back top twitter may capacity experiencing momentary hiccup try visit twitter status information add location information tweets city precise location web via third party applications always option delete tweet location history learn url tweet copy easily share friends add tweet website copying code learn moreadd video website copying code learn morehmm problem reaching server try embedding twitter content website app agreeing twitter developer agreement developer policy timeline spend time getting instant updates matters hover profile pic click following button unfollow account see tweet love tap heart lets person wrote know shared love fastest way share someone else tweet followers retweet tap icon send instantly add thoughts tweet reply find topic passionate jump right get instant insight people talking follow accounts get instant updates topics care see latest conversations topic instantly catch instantly best stories happening unfold
Health & General,b'https://infiniteautomation.com/',edge cloud connectivity high performance historian database alarms reports stunning data visualization box learn morea browser based cross platform software application uses standard html includes powerful toolbox create stunning dashboards web apps hmi screens learn morea compact powerful arm based linux server replaces expensive power hungry equipment plug play appliance learn morea compact powerful intel atom based linux server replaces expensive power hungry equipment plug play appliance specially designed industrial environments learn large systems mango seamlessly scales global iiot system capable processing millions values per second mango includes powerful data syncing system sync data remote mango installations central mango installation mango uses non proprietary software libraries easy bring new people transition staff turns projects expand bring people existing knowledge able jump without extensive training applications building automationmango lets know actually happening building real time updates status alarms scheduled performance reports mango used total building control system complement existing building automation systems providing high end graphics dashboards reports mango unlimited data point license makes great choice large scale data collection energy efficiency projects analytics performance tracking data center monitoringwith diverse protocol support snmp bacnet modbus sql others along unlimited data point license mango delivers powerful highly scalable solution monitor critical infrastructure rack level health pue generate customer energy bills much energy monitoringthe mango campus energy dashboard complete solution monitoring displaying energy data campus uses mango html5 api fully mobile compatible template customizable designed quickly deployed customized free download personal license non commercial evaluation usea flexible development platform mobile friendly dashboards web mobile apps kiosksall one iot hardware solution data acquisition automation visualizationwe dedicated partnerships resellers system integrators oemsabout pricing features download blog contact privacycopyright infinite automation systems inc
Health & General,b'http://mangosfargo.com/',offer authentic mexican cuisine affordable combination platters enchiladas answer craving mexican food something everyone mango burgers fish super burrito rules rice beans best jeff l visit us enjoy weekly food drink specials also daily lunch dinner specials change rotating basis privacy policy cookie policy conditions use notice take policy powered hibu content website owned us licensors copy content including images without consent
Business,b'https://www.mangomangeaux.com/',location hours33 e mellen sthampton va sunday pm brunch monday saturday breakfast pm lunch pmdinner pm pm wish join teamcontact us contact comjoin dream team mango mangeaux simply panache bistrohomesimply panache care packagecovid lemon aide drivefaqsmenusorder onlinereservationsour storydining add onsgift cards storeeventssister companiesthe last strawcontactmenusmore location hours events e mellen sthampton va 9189sunday brunch pm monday saturdaybreakfast pm lunch pmdinner pm pmwe proud provide restaurant upstairs atmango mangeaux rooftop mango mangeaux private parties events also host events exclusive bistro menus crafted flavor infusions three distinct cuisines french creole neosoul cuisines meaningful us possess comfort classic flavor heritage french cuisine stylish elaborate imbued style flair creole cuisine unique mix flavors satisfying one appetite building celebration around meal neosoul cuisine crafted soul food tradition fills bellies hearts recipes passed generation generation honors culinary heritage neo jazzy way touch gourmet mango mango mango preserves delicieux monday thursday pm pm seven dollar appetizers bar drinksbar patio seating get updates special events
Brand,b'https://www.macys.com/shop/womens-clothing/mango-fashion-clothing?id=240544',reference 4e25d117 1badf8de
