cluster_no,link,content
Health & General,b'http://mangomangodessert.com/',contact usabout usjoin franchisemangomangodessert comour story began new york chinatown inspired constant innovation city decided fuse sweet soups traditional hong kong style modern desserts mango mango desserts design studio fresh desserts definitely surpass rest dessert industryyear founded2013open locations30 states12 make edible incrediblefrom blended drinks fruit teas handmade desserts brand offers refreshing healthier alternative fruit tea favorites instant hit new york brand soon launched menu handmade fresh fruit drinks customers easily take branches across globe still growing giving taste nature tastemango mango dessert waned better serve guests savor taste different quality products
Health & General,b'https://www.nitrc.org/projects/mango/',browse tool details jack lancastermichael martinezmick foxangie lairddownload current release mac os x url current release windows url current release unix linux url imango download imango ipad url show files download see filestool resource newsmango version released posted michael martinez jul 2016tool resource newsmango version released posted michael martinez feb 2016tool resource newsmango version released posted michael martinez nov 2015tool resource newsmango version released posted michael martinez sep 2015tool resource newsmango version released posted michael martinez aug 2015tool resource newsmango version released posted michael martinez jun 2015tool resource newsmango version released posted michael martinez dec 2014tool resource newsmango version released posted michael martinez nov 2014tool resource newsmango version released posted michael martinez sep 2014tool resource newsmango version released posted michael martinez sep 2014mango imango releasedownload imango ipad posted michael martinez mar 2011mango current release releaseunix linux posted michael martinez apr 2008mango current release releasewindows posted michael martinez apr 2008mango current release releasemac os x posted michael martinez apr 2008home pageneurolex id nlx 155804rrid scr 009603funding support mango software development provided part icbm grant p01 eb01955 nih nimh brainmap grant r01 mh074457 nih nimh primary support continuing software development provided mango grant r01 eb015314 01a1 nih nibib news items 28total downloads 13349registered apr 2008organization uthscsacenter riimonitor file release subscribe rss feed news new releases bookmark pageadd reviewjoin teamuser reviews v2 0funded nih grant number 1r24eb029173
Health & General,b'https://www.bpl.org/learning-tools/language-learning/',search catalog items access online services requiring log unavailable friday april due scheduled maintenance personalized remote services available sunday april monday april due patriots day holiday consiste en dos recursos principales enciclopedia moderna para edades de escuela secundaria posteriores britannica escolar online para edades de consists two resources enciclopedia moderna high school students britannica escolar online ages language learning ages including arabic chinese english french german hebrew italian japanese russian spanish interactive language learning resource supporting dozens languages including chinese mandarin cantonese english hindi spanish watch tutorialopens new window resources subject resources format ejournals title journal citation abbreviationsopens new window powered bibliocommons biblioweb app01 version last updated
Health & General,b'https://food.ndtv.com/food-drinks/8-incredible-benefits-of-mangoes-the-king-of-fruits-1833145',sushmita sengupta updated july istwith history delicious mangoes make one popular fruits across world addition sumptuous pulpy amazing mangoes pack host health benefits needed reason gorge amazing fruit helps digestiongoogletag cmd push function googletag display adslotnativevideo mangoes could help facilitate healthy digestion according book healing foods dk publishing mangoes contain enzymes aid breakdown digestion protein also fibre keeps digestive tract working efficiently dietary fibre helps lowering risk heart disease type diabetes green mangoes pectin fibre ripe mangoes also read fruits help better digestion mangoes contain enzymes aid breakdown digestion protein also fibre2 promotes healthy gutaccording book healing foods mango flesh contains prebiotic dietary fibre helps feed good bacteria gut healthy gut detrimental healthy state leaky gut apart poor digestion results skin conditions like ibs asthma slow metabolism health issues also read kanji miracle winter drink healthy gut mango flesh contains prebiotic dietary fibre helps feed good bacteria3 boosts immunity would surprised know average sized mango contains upto two third daily recommended intake vitamin c powerful antioxidant helps boost immunity system prevents cold flu also read aam panna makes pulpy drink ultimate summer thirst quencher mango contains upto two third daily recommended intake vitamin c promotes eye health including mangoes diet may also help promote eye health mangoes rich beta carotene helps production vitamin powerful antioxidant helps improve vision boosts overall eye health even prevents age related macular degeneration loss vision mangoes rich beta carotene helps promote eye health5 lowers cholesteroleating mangoes could help regulate cholesterol levels high levels fibre pectin may help bring low density lipoprotein ldl bad cholesterol causes plaques vessels blocks blood flow also read fruits include cholesterol diet high levels fibre pectin may help bring low density lipoprotein ldl clears skin mangoes filled skin friendly vitamin c vitamin crucial healthy skin skin repair mangoes eaten moderation also known exfoliate eliminate dead pores according macrobiotic nutritionist health practitioner shilpa arora nd mangoes loaded skin healing nutrients example fibre mangoes cleanses gut overloaded toxic substances mangoes filled skin friendly vitamin c vitamin a7 even diabetics could enjoy ityes sweet eaten sparingly make mangoes strict diabetics glycemic index mangoes ranges average value lower end glycemic index scale foods less consider low glycemic food safe diabetics consume foods low glycemic index makes sure release sugar blood slow sudden spike blood glucose levels besides mangoes also rich dietary fibres helps regulate blood sugar levels glycemic index mangoes ranges average aids weight lossmangoes eaten moderation could also help weight loss phytochemicals mango skin act natural fat busters mango flesh filled dietary fibres fibres induce feeling satiety eating high fibre fruits veggies feel full longer time prevents tucking high fattening snacks mango promotes quick weight loss summers mangoes waiting let digging begin sushmita senguptasharing strong penchant food sushmita loves things good cheesy greasy favourite pastime activities discussing food includes reading watching movies binge watching tv shows
Mango Languages,b'https://www.ccpl.org/mango-languages',access database home charleston county public library card access database inside library learn new language mango online language learning system take course spanish french english spanish speakers italian japanese mandarin chinese brazilian portuguese one many languages copyright charleston county public library powered ebsco stacks staff loginp 6930subscribe ccpl newsletters
Brand,b'https://www.tangomangonewton.com/',homeaboutmenucontactmore1191 center street newton 8100monday saturday 30am 10pmsunday 11am 9pm tango mango
Business,b'https://www.mangobistro.com/',covid resource page changes making mango bistro information available resources restaurant employees impacted crisis click informationopen curbside deliveriesaddress w dearborn st englewood fl 34223phone 3500hours mon thurs 9am 3pmfri sat 9am 45pm live music fri sat starting 45pmclick see schedulethis website uses cookies continuing browse website agree privacy policy
Health & General,b'https://metacpan.org/pod/Mango',pause users non pause users mango pure perl non blocking mongodb drivermango pure perl non blocking mongodb driver optimized use mojolicious real time web framework multiple event loop support since mongodb still changing rapidly latest stable version supported mongodb support use mango learn mongodb take look official documentation documentation included distribution replacement look mango collection crud operations many arguments passed methods well values attributes get serialized bson mango bson provides many helper functions use generate data types available natively perl connections reset automatically new process forked allows multiple processes share mango object safely better scalability epoll kqueue provide ipv6 socks5 well tls support optional modules ev io socket ip io socket socks io socket ssl used automatically installed individual features also disabled mojo ipv6 mojo socks mojo tls environment variables mango inherits events mojo eventemitter emit following new ones emitted new connection established mango implements following attributes default database defaults admin servers connect defaults localhost port maximum amount time seconds connection inactive getting closed defaults setting value allow connections inactive indefinitely event loop object use blocking operations defaults mojo ioloop object wait operations reached journal defaults maximum size bson documents bytes defaults 16mb maximum number connections use non blocking operations defaults maximum number write operations batch together defaults protocol handler defaults mango protocol object wait operations reached least many servers indicates primary indicates primary least one secondary defaults timeout write propagation milliseconds defaults mango inherits methods mojo base implements following new ones number queued operations yet assigned connection build mango database object database uses default db name provided note reference mango mango database weakened mango object needs referenced elsewhere well parse configuration connection string perform low level get operation also append callback perform operation non blocking perform low level kill cursors operation also append callback perform operation non blocking construct new mango object parse connection string string necessary strongly recommended build mango object inside helper function like shown synopsis mango object reference inside mango database objects weakened avoid memory leaks means mango instance quickly going get undefined use db method use helper prevent username password provided mango try authenticate using scram sha1 warning require authen scram installed default extra arguments given connection string passed connect method mojo ioloop client connect server using tls use options tls boolean tls cert optionally tls ca perform low level query operation also append callback perform operation non blocking set mango debug environment variable get advanced diagnostics information printed stderr work distribution sponsored drip depot thank sebastian riedel sri org current maintainer olivier duclos odc org alphabetical order alexbykandrey khozovcolin cyrcopyright c sebastian riedel program free software redistribute modify terms artistic license version https github com oliwer mango mojolicious guides http mojolicio us install mango simply copy paste either commands terminalcpanmcpan shellfor information module installation please visit detailed cpan module installation guide
Business,b'http://mangosgrill.net/',highway west winona mn serving winona surrounding areas dine carry patio seating available home margarita day wednesdays great rates get even better discounts applied students receive military members get show ids find genuine meal winona surrounding areas almost every aspect food made house use spices come try fajitas molcajetes restaurant hours monday thursday pm friday pm saturday pm sunday pm call make reservation happy hour mon thurs pm pm valid promotion coupon mood authentic mexican american meal satisfy hunger delicious food mango mexican american grill due covid minnesota governor tim walz decided temporarily close dining areas restaurants bars tueday march 17th 5pm still open carry curbside delivery local areas hours monday friday 00am 00pm saturday sunday 30am pm place order call us please stay healthy hope see real soon privacy policy cookie policy conditions use notice take policy powered hibu content website owned us licensors copy content including images without consent mango mexican american grill mexican american grill hwy west winona mn
Health & General,b'https://www.mangomangos.com/',mango mango opened june decade later experience mango mango still much great meal friendly people escape humble beginnings little yards sandy beaches great surf st augustine beach fl unique food laid back island atmosphere well mistique ancient city keeps people coming back time time tel email email protected salted pretzel bites served spicy queso cajun fried chicken sweet hawaiian slider buns homemade datil pepper jam served one side flat crispy fries topped pico de gallo jerk bacon scallions spicy queso shaved rib eye cheddar caramelized onions sriracha horseradish aioli brioche bun served one side a1a beach blvdst augustine fl
Mango Languages,b'https://www.dclibrary.org/mango',want search looking learn new language learn phrases upcoming trip try mango languages interactive online resource providing audio tutorials practice reading listening speaking different languages also esl courses arabic cantonese mandarin french german greek italian japanese korean brazilian portuguese polish russian spanish turkish vietnamese speakers instructions visit mango languages guide download app get access go ios app app store android app google play visit
Health & General,b'https://www.gl-inet.com/products/gl-mt300n-v2/',gl mt300n v2 upgraded new chip mt7628nn ram enhanced 64mb 128mb also mtk driver helps improve wi fi connections coupled faster openvpn encryption gpios included diy fun gl mt300n v2 best pal travel added security help stay secure public wi fiable use laptop power bank standard 5v 1a dc adapters sold separately power supply converting public network wired wireless private wi fi secure surfing tethering 3g 4g usb modem compatible 39g oz pocket friendly mango connected internet ethernet cable wireless repeaterapart powerful built firewall mango also supports vpn wireguard dns server level online security brand new web ui set vpn server easily configured vpn server allow users access files securely home wireguard registered trademark jason donenfeld dns tls security protocol encrypting wrapping domain name system dns queries answers via transport layer security tls protocol serves increase user privacy security preventing eavesdropping manipulation dns data via man middle attacks placeholder placeholder gl technologies hk limited microuter technologies limited unit f building 19w science park west avenue hong kong science park pak shek kok n hong kong copyright gl technologies microuter technologies
Health & General,b'https://felixinstruments.com/food-science-instruments/portable-nir-analyzers/f-751-mango-quality-meter/',questions pm mon fri pacificremove guesswork accurately predict crop harvest dates reduce waste cut crop spoilage easy box operation using state art nir near infrared technology f mango quality meter precisely non destructively measures dry matter brix mango key quality ripeness indicators enables growers accurately predict crop harvest dates reducing guesswork minimizing spoilage increasing harvest predictability model built tommy k ataulfo also known champagne honey adolfo kent calypso keitt honey gold varieties english spanish spectrometer hamamatsu c11708marange nmspectral sample size nmspectral resolution nm fwhm maximumlight source halogen tungsten lamp gold reflectorlens fused silica coated enhance nirshutter white painted reference standarddisplay sunlight visible transflective lcd screen backlightpc interface wi fidata recorded raw data reflectance absorbance first derivative second derivative gps coordinates date timemeasurement dry matter brixpower source removable milliamp hour lithium ion batteriesbattery life measurementsbody heavy duty powder coated aluminum bodydimensions x w thickweight kgclick download latest validation data remove guesswork accurately predict crop harvest dates reduce waste cut crop spoilage easy box operation using state art nir near infrared technology f mango quality meter precisely non destructively measures dry matter brix mango key quality ripeness indicators enables growers accurately predict crop harvest dates reducing guesswork minimizing spoilage increasing harvest predictability model built tommy k ataulfo also known champagne honey adolfo kent calypso keitt honey gold varieties english spanish spectrometer hamamatsu c11708marange nmspectral sample size nmspectral resolution nm fwhm maximumlight source halogen tungsten lamp gold reflectorlens fused silica coated enhance nirshutter white painted reference standarddisplay sunlight visible transflective lcd screen backlightpc interface wi fidata recorded raw data reflectance absorbance first derivative second derivative gps coordinates date timemeasurement dry matter brixpower source removable milliamp hour lithium ion batteriesbattery life measurementsbody heavy duty powder coated aluminum bodydimensions x w thickweight kgclick download latest validation data english spanish spectrometer hamamatsu c11708marange nmspectral sample size nmspectral resolution nm fwhm maximumlight source halogen tungsten lamp gold reflectorlens fused silica coated enhance nirshutter white painted reference standarddisplay sunlight visible transflective lcd screen backlightpc interface wi fidata recorded raw data reflectance absorbance first derivative second derivative gps coordinates date timemeasurement dry matter brixpower source removable milliamp hour lithium ion batteriesbattery life measurementsbody heavy duty powder coated aluminum bodydimensions x w thickweight kgclick download latest validation data remove guesswork accurately predict crop harvest dates reduce waste cut crop spoilage easy box operation using state art nir near infrared technology f mango quality meter precisely non destructively measures dry matter brix mango key quality ripeness indicators enables growers accurately predict crop harvest dates reducing guesswork minimizing spoilage increasing harvest predictability model built tommy k ataulfo also known champagne honey adolfo kent calypso keitt honey gold varieties sales com office com 8835fax
Mango Languages,b'https://www.wccls.org/research/mango-languages',wccls libraries continue serve home las bibliotecas contin sirvi ndole en casa use page save link browser favorites bookmarks list english speakers learn languages arabic armenian vietnamese yiddish speakers languages learning english english language courses offered languages including arabic korean russian spanish somali booklists emailabout wccls contact usstaff resourcescopyright 2020washington county cooperative library services oregon
