cluster_no,link,content
Journals & Articles,https://www.nytimes.com/2019/08/24/opinion/sunday/peaches-california-climate-change.html,advertisementsupported byan annual picking trip california farm become window daunting climate work challenges miriam pawelcontributing opinion writerdel rey calif first visited tiny farm town pick peaches expect return certainly every summer yet july triple degree heat ninth straight year pilgrimage friends orchard south fresno near geographic center california come harvest peaches tree adopted farm year old david mas masumoto third generation japanese american farmer began adoption program connect people food find homes old fashioned fruit delicate commercial sale succeeded ways could foreseen drawn back summer intense flavor heirloom fruit even unexpected attachments deepened harvests bonds among members multigenerational team ties masumoto family connection decades old elberta peach tree year particular underscored profound lessons annual trek become window changing nature perpetually fragile enterprise perilous era longer normal central valley farmer climate change brought extremes heat precipitation play havoc harvest season elongated unpredictable farm labor long one factors growers could control become equally unpredictable immigration crackdowns cause shortages fear suffuses largely undocumented mexican farmworker community state return next year see one tangible consequences peach tree two thirds former height trees acre farm pruned make easier cared women become necessity preferred workers small farm labor shortage shows sign abating masumotos hope turn challenge opportunity shaping trees produce fewer larger peaches command higher price farmers accustomed forces beyond control freakish storms droughts tariffs recessions consumer habits farms adapt die masumotos would typically hire dozen workers peak harvest year picked entire crop four plus family mas masumoto organic entrepreneur author wife marcy educator school board member daughter nikiko queer feminist performance artist farmer son korio graduated fresno state masumotos california story unique blend genuine earth warmth rock star status universal immigrant roots optimism innovation mr masumoto grandfather part wave japanese immigrants early 20th century quickly moved working fields running farms japanese operated farms produced percent state crops despite racist exclusionary laws made owning property difficult came president franklin roosevelt order intern people japanese ancestry wide swath west coast designated theater war mr masumoto parents among mostly californians citizens rounded imprisoned talk children trauma heirloom peach trees mr masumoto father lovingly planted almost lost mr masumoto wrote angry op ed essay year los angeles times explained decision bulldoze burn trees consumers shunned succulent amber peaches produced favor red tasteless orbs bred durability appearance one wants peach variety wonderful taste wrote essay prompted outpouring persuaded mr masumoto hold sun crest trees unleashed cult following peaches became featured menu restaurants like berkeley chez panisse although grew farm never missed harvest nikiko masumoto intention return home went university california berkeley following father footsteps followed moving back home carry family legacy convinced farming could vehicle social activism civic responsibility inherit challenge responding climate change last summer set records fresno july hottest month history consecutive days temperature hit topped degrees last five years warmest record fresno came two years severe drought among driest ever followed torrential rains mr masumoto believes trees embarked mysterious evolutionary strategy survival daughter experimenting ways irrigate less water become even scarcer commodity state first limits groundwater pumping go effect 2020s ripped unproductive vines also cultivate small crop organic grapes raisins replaced leaving percent land fallow also getting difficult keep workers increasingly competitive market fear among workers without legal papers great last year family backed masumotos last minute reasoning would safer working labor contractor large farm would provide greater anonymity age uncertainty something reassuring land trees persevere half dozen members team converge central valley los angeles salinas sacramento bay area mix journalists lawyers nonprofit executives new recruit two year inducted familiar routines jokes arguments friday night barbecues started back hotel shadow highway tale team member forsook us one year hike john muir trail airlifted medical emergency peach gods angry mas masumoto roared wide mischievous grin harvests become way mark years since first season mas heart bypass surgery marcy nikiko published cookbook nikiko gave tedx talk performed white house married spring orchard rows youngest team high school first came del rey works food gleaning organization team members retired changed jobs wrote books daughter founding member took father place first grandchild born summer endings farming mas masumoto says next season miriam pawel author browns california family dynasty transformed state shaped nation contributing opinion writer times committed publishing diversity letters editor like hear think articles tips email letters com follow new york times opinion section facebook twitter instagram advertisement
Journals & Articles,https://poets.org/poem/peaches,find share perfect poems crate peaches straight farmhas maintained eaten days obvious family went fast never saw mess punishes delay thought everyone bought fruit crate stored coolest part house devoured could rot peach state thosewho ask originally like reply homeland peach nice might look truth reason bought muchdid chinese leastchinese part america strangersand natives lonely beautiful streetwhere food came stackable containersand fussy bags unless bothered driveto source money landeda bushel fruit twenty pound sack rice drive anyway house surroundedby land enough grow lawnshadn required home loved stareinto extra freezer reviewing mountainsof foil wrapped meats cakes juice concentrate mysterious packets brought house guestsfrom new york chinatown transformedby heat force mother patient effort enough keep us fed flood storm provided power stayed fire icecould procured would labor intensive everything else parents lives labor kept kids grew confuse work pleasure become typical immigrants children taller parents unaware hungerexcept asked odd perplexing question copyright adrienne su originally published poem day october academy american poets receive new poem inbox daily started poem bought crate local peaches managed eat reached exhaustion bottom crate dozen enormous peaches remained threatening rot asked buy many time adrienne su1words dowhat bird bonescan stewto stonyessenceof onesmall soul spentsacrifice boiled downto hard whitematter nourishesthe mightypredator flourisheson slaughteredanimal water 2who feedsanother like bonesto eats say onlybecause manin housewho eats womanwho goes aboutthe matter sustenance food alwaysa matter life anddeath day sdininganother small dying 3scallops searedin hot ironwith grated ginger rice wine little oilof sesame servedwith boiledjasmine rice curesthe malaiseof long fluorescentweekdaysspentin cityfor money 4i afraidi always behere needa warm bodyor words somedayi slipinto red clayi started withand forgetwho butfor smy offering baked redfish clear soup bread adrienne su1997the world largest confederate monument big perceive earliest trips park unlike parents immigrant learned speech writing represent picnicking foot sometimes peak world largest confederate monument raised cokes first georgian president daughter nine like jimmy carter unlike father immigrant teachers tour guides stressed achievement turning three vertical granite acres art since one called confederate monument remained invisible like outdated wallpaper meant long ago stripped nothing stone mountain park echoed ancestry normal immigrants see landmarks summer nights fireworks laser shows obscured sparks world largest confederate monument story began parents arrived immigrants adrienne su2019
Journals & Articles,https://www.rockhillorchard.com/peaches,nothing beat freshly picked peach rock hill orchard grow many different varieties new rows trees ready week early july early september youngest son assures us peaches one eat one day peach picking tipspick firm peach tree let ripen home peaches unlike apples ripen tree roll peaches tree cupped hand leave finger prints put gently basket provide cardboard boxes pick minimize possibility peaches getting squished want keep peaches several days store refrigerator take put counter several days eating rock hill orchard peach ripening schedulepeach varietyapproximate ripening datecolorcling freestonepf flamin fury julyellowsemi clingdesiree julyellowsemi freestonecandor julyellowclingspring snow julwhiteclingearlystar julyellowsemi freestonegarnet beauty julyellowfreestonesentry julyellowsemi freestonepf julyellowfreestoneglenglo julyellowfreestonegala julyellowfreestoneredhaven augyellowfreestonewhite lady augwhitefreestonejohn boy augyellowfreestoneraritan rose augwhitefreestonepf flamin fury augyellowfreestonesunhigh augyellowfreestonecoralstar augyellowfreestonebounty augyellowfreestoneloring augyellowfreestoneharmony augyellowfreestonepf flamin fury augyellowfreestonepf flamin fury augyellowfreestonesummer breeze25 augyellowfreestonecresthaven augyellowfreestoneredskin augyellowfreestonepf 27a flamin fury augyellowfreestoneencore sepyellowfreestonelaurol sepyellowfreestone
Journals & Articles,http://peachesinn.com/,peaches elegant georgian manor style home located heritage hill downtown grand rapids michigan guests find beautiful bright uncluttered rooms luxurious amenities spectacular gardens memorable hospitality business travelers tourists weary frustrated routine accommodations first priority room rate per night check time pm checkout time unless prior arrangements made reserve guests find beautiful bright uncluttered rooms luxurious amenities spectacular gardens memorable hospitality business travelers tourists weary frustrated routine accommodations first priority room rate per night check time pm checkout time unless prior arrangements made reserve room rate per night check time pm checkout time unless prior arrangements made reserve free wi fi queen beds private baths electric vehicle charging station full delicious breakfast every day sheets dried outside always abundance original art enjoy walking distance downtown take tour contact us contact us contact us created magically nostalgic b b surpassing expectations thank beautiful hospitable splendidly maintained friendly welcoming pooches great enjoyed stay much friendly hosts friendly dogs excellent breakfast beautiful home great food wait come back lovely home enjoyed legged greeters guys awesome liked stay much last year come back perfectly exceptional accommodations charming est hostess enchanting stay great place awesome pancakes love jazz artwork dogs everything lovely slept good years food delicious nice break little oasis stress life copyright peaches b b home check room availability faq tour guest bedrooms events parties weddings meetings news packages contact
Journals & Articles,https://pearsonfarm.com/collections/peaches,items shopping cart shop items shopping cart shop building experience generation pearson family gained reputation growing sweetest juiciest peaches country everyone pearson farm takes pride growing best tasting peaches year year enjoys bringing smile faces customers every summer bite new crop glad found us hope enjoy eating peaches much growing sign stay loop new products recipes specials toll free fax email customerservice com customer support hours monday friday pm est customer support hours monday friday pm est customer support hours monday friday pm est phone 0750email angela com
Journals & Articles,https://nrich.maths.org/peachestoday,beginning night three poker players alan bernie craig money ratios end night ratio one assets players beginning evening according plutarch greeks found rectangles integer sides whose areas equal perimeters find rectangular boxes integer sides surface areas equal volumes using operations addition subtraction multiplication division using digits make expression equal problem three parts feeling confident working fractions might want skip straight part ii part iii little monkey peaches first day decided keep bf frac peaches gave rest away ate one second day decided keep bf frac peaches gave rest away ate one third day decided keep bf frac peaches gave rest away ate one fifth day decided keep bf frac peaches gave rest away ate one many left end ii little monkey peaches day kept fraction peaches gave rest away ate one fractions decided keep frac qquad frac qquad frac qquad frac qquad frac qquad frac order use fractions left one peach end click poster part ii problem
Journals & Articles,https://peachesandcreamnc.com/,famous homemade cobblers available daily fan favorite available summer long refreshing smoothies available daily sweet summer peaches one life greatest treasures fresh blackberries peak season june start summer sweet delicious strawberries fresh blueberries available summer peaches n cream committed offering best local peaches tomatoes corn blueberries squash peak season full flavor serve smile sell local produce picked peak ripeness offer produce grown family farm farms community fresh juicy ripe flavorful sweet produce beat peaches n cream produce stand offering fresh local produce grown right family farm phillips farm also famous fresh homemade ice cream available every day
Journals & Articles,https://extension.uga.edu/topic-areas/fruit-vegetable-ornamentals-production/peaches.html,see programs servicesour impactgeorgia two commercial peach growing regions central region largest million peach trees percent state production southern region produces million pounds peaches annually although georgia called peach state country leading producer peaches still georgia produces million pounds peaches year uga extension provides farmers home gardeners variety information help best output least amount labor possible uga peach blog news timely updates peach production georgia peaches uga resources peach commercial home production planting storing georgia peach team council contacts sustainable agriculture uga brings together information sustainable agriculture including organic agriculture pollinators resources impact statements peaches descriptions extension efforts improve knowledge practices related peaches uga department horticulture learn horticulture department uga college agricultural environmental sciences uga department plant pathology learn plant pathology department uga college agricultural environmental sciences commodity teams caes teams made research scientists extension specialists work together provide latest technology information efficient profitable production georgia valuable commodities georgia peach council peach facts grower profiles nutrition information recipes current news events displaying farm gate values values tallied october previous year faculty staff every county across state available assist county offices currently closed public however may still call email local extension office assistance translate science everyday living farmers families communities foster healthy prosperous georgia century provided research education network committed specialists agents volunteers help georgians learn grow
Journals & Articles,https://www.nutrition-and-you.com/peaches.html,delicious widely popular peaches native china spread rest world via ancient silk route peach fruits belong genus prunus family rosaceae scientific name prunus persica technically peach fruit drupe similar features prunus members including plums nectarine almonds damson adsbygoogle window adsbygoogle push peach plant described small deciduous tree grows feet tall widely grown united states europe china juicy fruits several cultivars peach grown world differ color size growing characteristics based upon regions origin donut peach saturn peaches prunus persica var platycarpais flattened disc like freestone fruit drawn inward like disc center white flesh similar peach flavor taste internally flesh soft juicy sweet tart pleasant fruity aroma depending variety flesh may feature white creamy yellow color centrally placed single pit stone encloses almond apricot like kernel inside hard shell pit kernels edible small quantities wonderfully delicious peaches low calories g provide calories contain saturated fats nonetheless packed numerous health promoting compounds minerals vitamins total measured antioxidant strength orac value g peach fruit te trolox equivalents fresh peaches moderate source antioxidant vitamin c vitamin c antioxidant effects required connective tissue synthesis inside human body consumption foods rich vitamin c helps develop resistance infectious agents help scavenges harmful free radicals fresh fruits also small source vitamin carotene carotene pro vitamin converts vitamin inside body vitamin essential night vision also essential maintaining healthy mucus membranes skin consumption natural fruits rich vitamin known offer protection lung oral cavity cancers rich many vital minerals potassium fluoride iron iron required red blood cell formation fluoride component bones teeth essential prevention dental caries potassium important component cell body fluids help regulate heart rate blood pressure peaches contain health promoting flavonoid poly phenolic antioxidants lutein zeaxanthin cryptoxanthin compounds help act protective scavengers oxygen derived free radicals reactive oxygen species ros play role aging various disease processes adsbygoogle window adsbygoogle push peaches available year round however season fresh fruits lasts may october stores look fresh ones featuring rich color may still slight whitish bloom surface indicating freshness handled avoid ones excessive softness surface cuts bruises ripe fruits yield gentle pressure feature sweet aroma slightly hard mature fruits kept room temperature ripen ripening process enhanced applying ethylene similar ripening bananas storing inside paper bag concentrates gas hastens ripening process ripe fruits kept refrigerator preferably brought back room temperature eating enjoy rich flavor dried peaches also available select stores along raisins currants apricots dates etc wash cold running water using fresh ripe peaches enjoyed whole along skin otherwise incise fruit lengthwise deeply hard seed felt remove seed skin peeled using paring knife apples apples sliced peach fruit sections turns brown exposure air enzymatic brownish discoloration due conversion ferrous oxide ferric oxide serve sliced rinse slices water added drops fresh lemon peel skin score small cross base end using knife dip boiling water half minute immediately immerse cold water cool quickly peel skin away cross serving tips peach sections great addition fruit salads fresh fruits used variety fruit cocktails along grapes pineapple cherry plums peaches used preparation pie baklava charlottes tart desserts jams jellies also used various traditional recipes peaches less allergic foods consumption peach kernels large amounts period time however cause weakenss stomachache medical disclaimer adsbygoogle window adsbygoogle push back fruits peaches visit impressive list variety fruits complete illustrations nutrition facts health benefits back home page reading resources virginia cooperative extension usda national nutrition database usda national nutrient database sitemapupdated apr copyright umesh rudrappa rights reserved home us contact blog sitemap privacy policy disclaimer
Journals & Articles,https://www.health.com/nutrition/health-benefits-peaches,turns stone fruit natural de bloater peaches member stone fruit family along nectarines plums apricots cherries fun fact also relative almonds addition downright delicious especially peak peaches offer unique health benefits eight reasons get fill gorgeous fuzzy fruit plentiful one medium peach provides nearly daily minimum fiber target addition preventing constipation supporting good digestive health peach fiber helps manage blood sugar levels peaches also contain prebiotics feed beneficial bacteria gut tied anti inflammation immunity mood peaches support immunity three ways one medium peach supplies daily goal vitamin c several types immune cells need nutrient production function protection vitamin peaches one medium fruit provides daily need helps form mucous membranes respiratory tract stronger membranes form better protective barriers keep germs bloodstream peaches also defend immunity way natural antimicrobial properties addition anti inflammatory antioxidants peaches beta carotene vitamin c support healthy skin beta carotene precursor vitamin helps protect skin sun damage warms skin tone helps create natural glow vitamin c needed build collagen improve skin elasticity fend sagging peaches also hydrating fresh peach water related creative peach recipesthe lutein zeaxanthin peaches help protect retina lens shown reduce risk macular degeneration cataracts two common eye disorders vitamin peaches also helps support healthy vision rare true deficiency vitamin lead condition called xerophthalmia damage normal vision result night blindness inability see dark low light polyphenol antioxidants peaches shown inhibit growth spread cancer cells particularly breast cancer one study followed women years found two fruits particular stood protective higher intake berries peaches associated lower risk estrogen receptive negative breast cancer among post menopausal women recent research shows bioactive compounds peaches anti inflammatory anti obesity properties ability help regulate blood sugar insulin levels filling fiber water content also make smart choice weight management related health benefits blackberries including frozen kind antioxidants found peaches known combat oxidative stress essentially imbalance production cell damaging free radicals body ability counter harmful effects key brain health oxidative stress known causative factor neurodegenerative diseases alzheimer potassium peach one medium fruit supplies daily recommended goal helps regulate blood pressure acting natural diuretic sweep excess sodium fluid body relieves pressure heart arteries bonus helps de bloat peaches enjoyed savory sweet dishes whip peaches smoothies add oatmeal overnight oats puree sauces pudding frozen pops incorporate pie cobbler desserts enjoy peaches fantastic grilled added garden salads transformed salsa slivered slaw unlike cherries peaches continue ripen picked prefer juicer peach place paper bag room temperature speed transformation cynthia sass mph rd health contributing nutrition editor new york times best selling author nutrition consultant new york yankees get nutrition diet tips delivered inbox sign real wellness newsletter
Miscellaneous,https://www.urbanoutfitters.com/shop/allover-peaches-sheet-set2,please click robot continue access page denied believe using automation tools browse website may happen result following please make sure javascript cookies enabled browser blocking loading reference id 5ce210b0 811f 11ea 8a0b c5375efa5738 powered perimeterx inc
