cluster_no,link,content
Journals & Articles,https://www.baseball-reference.com/players/g/grahape01.shtml,position catcher bats right throws right 180lb 175cm 81kg born march aledo il us died july long beach ca buried cremated debut september age 175d 462nd mlb history last game june age 087d vs chc ab h hr rbi sb rookie status exceeded rookie limits season full name george frederick graham relatives father jack graham career3 66196minor lg statsbatting splitsbatting game logsfielding game logsbatting finders advanced statspitching finders advanced statsfielding finders advanced statsmore peaches graham pages baseball referencebattingbattingfieldingbattingpitchingfieldingmore peaches graham pages baseball referencepeaches graham overviewminor lg statsbatting splitsbatting game logsfielding game logsbatting finders advanced statspitching finders advanced statsfielding finders advanced statsmore peaches graham pages baseball referenceevery sports reference social media accountsite last updated tuesday april 48am question comment feedback correction stathead subscribe newsletterthis week sports referencefind add feature make changedo sports website write sports tools resources help use sports data find logos trademark property owners sports reference llc present purely educational purposes reasoning presenting offensive logos logos compiled amazing sportslogos net copyright sports reference llc rights reserved much play play game results transaction information shown used create certain data sets obtained free charge copyrighted retrosheet win expectancy run expectancy leverage index calculations provided tom tango insidethebook com co author book playing percentages baseball total zone rating initial framework wins replacement calculations provided sean smith full year historical major league statistics provided pete palmer gary gillette hidden game sports defensive statistics copyright baseball info solutions high school data courtesy david mcwater many historical player head shots courtesy david davis many thanks images property copyright holder displayed informational purposes
Miscellaneous,https://www.emeraldcitysmoothie.com/catalog/meal-replacement/peaches-and-greens,peach spinach banana almonds chiaemerald city smoothie stores open nationwide find one locations near store locator2 calories day used general nutrition advice calorie needs vary nutritional information available participating locations nutritional information available store copyright emerald city smoothie web design efelle creative
Journals & Articles,https://www.froghollow.com/products/organic-cal-red-peaches,offer nationwide home delivery staying healthy safe covid fresh fruit mixed fruit pre orders bakery deal day save limited time pantry subscribe save subscribe save weekly bi weekly monthly gifts price holidays occasions gift cards gifts every occasion clubs save fruit clubs beloved cal red class oh god peach relatively new variety california native cal red bred university california botanist claron hesse mid 1960s aptly named golden state cal red beautiful golden peach marked gentle sun kissed blush best selling variety cal red fans mark calendars eagerly await harvest year years cal red harvest window brief two weeks leaving huge impression peach fleeting availability new york times describes cal reds big handsome peaches unblemished ready savor dripping rich juice collections pre order pre orders staff pick summer tastiest peach battle wholesalefrom farm door without impact environment thanks carbon neutral shipping view details shipping rates order deadlines delivery estimates fulfillment schedule perishable vs non perishable products everything get packages please know due heightened demand order may experience shipping delays thanks patience questions please contact us love products besides delicious arches buy concerve perfect peachessent daughters away college loved spite ups driving around peaches phoenix un air conditioned truck full day peaches mostly survived warm one damaged great peaches perhaps could use golden states overnight least uses ac trucks phoenix deliver product ordered two boxes cal red peaches unfortunately delivered correctly notified frog hollow replaced deliveries excellent customer service buy let us help get know us frog hollow farm
Journals & Articles,http://www.auntpeaches.com/,hey friends anyone february daily painting challenge started one whim week surprise already taken one specific flowers 28februaryflowers instagram usually share regular artwork terrific platform read moreit brain juice goes art days mind thought might time throwback edition art history sunday painting one favorites think often moments self pity blind girl john everett millais read morehappy new year friends hope got great start lot going bad news pipe burst art studio water ran hours everything got wet covered frost whole place gutted everything tossed two weeks problem read moreoh goodness already october much going world days good downright scary want blanket crafts painting decorating pound size logs cookie dough appreciation dark humor reached new read morewhen kid used envy people lived near landmarks thought cool would say two blocks east purple gas station everyone would know exactly lived even spend time purple gas station purple gas station read morecopyright foodie pro genesis framework
Journals & Articles,https://www.castledangerbrewery.com/beer/peaches-cream-ale/,peaches cream ale version popular castle cream ale deep gold color soft malty aroma slightly sweet creamy texture balanced bitterness finishing smooth clean addition juicy peach enhances sweet aromas flavors cream ale without overpowering rare infusion brewed solely minnesota state fair gara always take scenic route j k love weekendadventure castledangle beer upnorth castledangerbrewery cheers twoharbors mn scenicdrive quote inspirationalquote minnesota liquor laws suck today marks first day castle danger brewery longer sell growlers luckily made quick trip yesterday got growler filled one last time sell growlers may ask reached state max barrels produced per year longer sale taproom problem breweries feel hit hard growlers account taproom sales losing income also effects consumer craft breweries typically make lot one specialty beers may available taproom growlers customers able take new favorites home without option consumers forced enjoy product house mention basically punishing breweries producing amazing high quality beer people love want buy want help show minnesota lawmakers want cap raised barrels link petition bio get enough signatures legislature look new law period support small business like dang job minnesota mn castledangerbrewery castledanger twoharbors northshore mnbeer beer redhop growler highway61 northernmn liquorlaws lakesuperior duluth beer craftbeer breweries brewery savethegrowler tunnel vision silver creek minnesota wildridge photography minnesota minnesotawinter minnesotaphotographer minnesota captures minnesotaexposure minnesotalife minnesotalove minnesota365 minnesotaphotographers minnesotaphotography moodyinminnesota moodysota sotastories captivatemn captureminnesota silvercreek silvercreekcliff silvercreekclifftunnel duluth duluthmn twoharbors castlesdanger castledangerbrewery northshore northshorescenicdrive boldnorth upnorth northernmn thisismyminnesota wheninmn tunnel vision silver creek minnesota wildridge photography minnesota minnesotawinter minnesotaphotographer minnesota captures minnesotaexposure minnesotalife minnesotalove minnesota365 minnesotaphotographers minnesotaphotography moodyinminnesota moodysota sotastories captivatemn captureminnesota silvercreek silvercreekcliff silvercreekclifftunnel duluth duluthmn twoharbors castlesdanger castledangerbrewery northshore northshorescenicdrive boldnorth upnorth northernmn thisismyminnesota pmphotoassignments love good beer fortunate many excellent breweries select taps constantly rotating always top notch unique incredibly delicious redravenbike cuyuna beer earthriderbrewery bigaxebrewery fairstatebrewing castledangerbrewery stackeddeckbrewing bemidjibrewing indepentbrewers fbf week ago northern mn middle freakin nowhere drinking favorite brew life fucking good castledangerbrewery mncraftbeer northernmn beer4sexy womenwholovebeer crackoneopen brewlocal 12ozcurls myhappyplace mnsummers patiopounder friends dogs best kind friends ended hike bomb craft brews complaints beers gave us impression cool minnesota castledanger castledangerbrewery brewery brew travel traveller travelling travelblog travelblogger usa america photography travelphotography summer well underway little sprout keeps growing especially enjoyed first trip castledangerbrewer goodtimes summernights northshore lakesuperior castledanger castledangerbrewery minnesotasign first know upcoming releases events castle danger brewery
Journals & Articles,https://m.toofaced.com/collections/peaches-and-cream,tutti frutti collection free shipping orders us free samples every order clicking register agree bound terms conditions privacy policy website yes email special offers exclusive product previews latest news faced clicking register agree bound terms conditions privacy policy website yes email special offers exclusive product previews latest news faced tutti frutti collection free shipping orders us free samples every order clicking register agree bound terms conditions privacy policy website yes email special offers exclusive product previews latest news faced clicking register agree bound terms conditions privacy policy website yes email special offers exclusive product previews latest news faced get lookpeaches creampeaches cream peach puff tipwith global beauty director elysepeaches cream crystal whipswith global beauty director elysepeaches cream peach perfect powder tipwith global beauty director elyse tfpeachesandcream get first purchaseby clicking subscribe accept e mail address used send faced newsletters information faced products events offers may right review change delete personal data make request sending email privacy com contact information click unsubscribe time clicking unsubscribing link newsletter information elc local entities faced privacy practices please see privacy policy receive text updatesmessages recurring message data rates may apply see full terms conditions privacy policy get best possible experience using website recommend upgrade modern browser
Journals & Articles,https://www.theppk.com/2011/06/grilled-peaches-with-ginger-coconut-caramel/,june comments serves 8grilled peaches everyone love summer dessert involve turning oven grill peach fruit really want exact right amount caramelization much bitterness little kind like eating warm peach many recipes call rubbing peaches sugar grilling think lead grill misfires pun really intended got lucky like method recipe peach simply sprinkled little lemon juice oil adding sugar lessens danger caramelization epidemic studies show affects peaches every barbeque instead rely caramel sweetness let move since really reason ginger coconut caramel sauce sweet fragrant smooth syrupy sauce elevates grilled peaches unforgettable even candy thermometer never made caramel recipe pretty easy forgiving try stop licking spoon try seriously burned tongue wait remember let cool bit first added bonus probably little extra drizzle ice cream throughout week say vegan vanilla ice cream total must love good old delicious soy based vanilla think coconut based one would great choice also use plain white sugar health food sugars seem work well caramels sure use beet sugar concerned non vegan filtration processes caramel cup sugar tablespoons water tablespoon pure maple syrup1 tablespoon cornstarch plus tablespoon water cup full fat coconut milk tablespoons coconut oil tablespoon fresh ginger grated microplane teaspoon salt peaches ripe peaches juice one lemon tablespoons canola oiland vanilla ice cream servefirst make caramel quart pot mix together sugar water maple syrup place medium heat stir wisk sugar dissolved dissolved stir much definitely keep close eye burn stir occasionally bubbly edges start turn shades darker seems bubbling wildly lower heat bit let cook way minutes meantime mix cornstarch tablespoon water slowly add coconut milk mixing fork thoroughly incorporate cornstarch caramel turns deep honey brown slowly stream coconut milk whisking constantly mix coconut oil ginger salt cook another minutes cornstarch thickens caramel bit let cool bit serve warm prepare peaches preheat grill medium high remember lightly grease first peaches stick easiest slice peaches width wise another way think around waist stem bottom pit come easier sliced hold end peach twist releases remove pit place peaches big bowl coat oil lemon juice use hands gently rub make sure coated grill peach face minutes use thin metal spatula lift grill tender awesome grill marks flip grill another minutes soften bit serve immediately ice cream drizzled caramel filed 4th july desserts featured gluten free grilling recipe summer tagged ginger peaches anna june pmdavid lebovitz great tips making caramel website demystifying whole process http www davidlebovitz com make disclaimer website vegan definitely gon na try version love ginger coconut milk caramelised sounds like perfect combination maybe one could even turn ice cream mmmm maya june pmoh earth ever eat peaches sans grilling coconut ice cream naked peaches forever ruined wait next time bbq try christopher allan webber june pm3 sugar presumably cup isachandra june amthanks fixed scissors spice june ambeautiful photo new obsession food photography adrianna cozy kitchen june amgrilled fruit jaaam love also love caramel addition kind takes whole thing notch melody polakow vegan day june pmgod look sound amazing tae june pmdo favorite vegan vanilla ice cream katrina june pmthis sounds awesome love trying peaches new ways great recipe kocinera june amthis looks like cool summery dessert sooo love coconut moment caramel sounds like total must try plus peaches look gorgeous carrie june ammy mouth watering thinking nom tastic concoction definite must 4th july weekend setting stuff fire eating grilled peaches ginger coconut caramel vanilla ice cream ultimate american pastime sorta well hope tummy wait entire week peaches may give recipe trial run considering less stellar culinary skillz may bad idea think oh dear find good organic peaches anywhere else pose much problem however sacked nation sweaty armpit southwest florida criminally insane choose live summertime produce chance time year mangos except mexico locally grown shipped state little fruit trees producing quite yet either girl apparently get serious sleep rant probably embarrass hell outta tomorrow even drinking sad huh least kind excuse trying say recipe looks buhlicious think could substitute mangos peaches never tried grill one although sure slicing would work fruits hmmm p thank godsend cookbook vegan w vengeance recently rediscovered vegetatianism working vegan trying eat meat nearly two years vegan eight years health issues thought give meat chance unfortunately made things worse anyway vegan vengeance lifesaver recently got appetite reduction wait try recipes well right novel time bed oxox sneaky vegan june amthis little pot awesome looks absolutely beauteous drool lilian june pmoh god cook love ginger coconut cream thanks lot sharing recipe best regards germany chris june am1 cup full fat coconut milkis stuff oz aluminum cans found shelf thia kitchen brand comes mind kind normally associate would stuff put cereal usually located non dairy milks isachandra june pmit canned stuff coconut milk carton called coconut beverage surprised associate coconut milk since relatively new product chris june pmhaha true relatively new vegan food probably associated coconut milk btw thanks clearing great blog website kimberly june pmthis ice cream flavor lauren july pmi made last night absolutely outstanding truly one best desserts ever made difficulty wise manageable dessert making phobe like thanks isa julie july pmwow needs belly right maya july pmgak drooling keyboard looks incredible nomnomnomnomnom gena july amscrumptious jess july pmthanks clarifying coconut milk beverage thing always think one goes cereal etc probably never used canned stuff bought books recipe looks amazing always thanks sharing fantastic katrina july pmholy yumminess batman naughtiest looking goody seen make thursday getting peaches wonderful farmer market thank sharing kelly nj july pmi made last night except used tofutti vanilla ice cream good ever tried kind peaches great obv jackie july pmlove love love grilled stone fruits season could eaten dozen dessert cups greenlifestyles july amthis looks amazing im trying recipe tonight greenlifestyles novicevegan july pmi made last night hubby liked much actually licked bowl clean dropped strong hints like today message received devouring another bowl grilled peaches stopping every give thumbs cute thank isa another masterpiece sofia july pmthis sounds delicious violet july pmtry coconut bliss brand vanilla naked coconut flavor organic good make see god lydia august amis coconut oil absolutely necessary caramel alternative wondering really afford coconut oil moment thanks isachandra august amyou use margarine andrea september pmthis looks fantastic difficult thank andrea gratitude ap blogspot com marsha september pmwhen first saw posted started thinking everything could caramel weekend made sans ginger make mom vegan turtle cake yum kaenhu march ami trouble grilling used nectarines instead peaches sale maybe problem grill long time still firmer wanted push really hard spoon break however ginger caramel sauce awesome really reminds asian dessert really like silken tofu ginger syrup going try using actual peaches next time totally going try silken tofu thank much isa meredith june pmso excited make friends tonight also share pinterest universe jessikerrenner august amthis looks rediculously good getting fresh georgia peaches farmers market weekend making promptly emily marlowe august pmthe caramel sauce amazing eat anything discovered even delicious next day hardens little read http www theppk com grilled peaches ginger coconut caramel post punk kitchen blog isa yet another drool worthy post time grilled peaches ginger caramel joy baker made peach raspberry crumble combining two favorite summer fruits adapted isa chandra recipes grilled fruit grilled peaches ginger coconut caramel isa chandra moskowitz yes grilled peaches ginger coconut caramel post punk kitchen peach cobbler coconut pancakes healthy foodie peach toasted coconut donuts edible perspective cookbook hint love dinner made falafel wraps served ppk grilled peaches ginger coconut caramel sauce coconut milk ice cream dessert guests rocked ice cream loving world brought fixins ppk grilled peaches ginger coconut caramel sauce ate coconut milk ice cream grilled peaches coconut milk ice cream grilled peaches ginger coconut caramel fruit intensifying flavor spice cinnamon serve vanilla ice cream add ginger coconut caramel try mascarpone raspberry grilled peaches w ginger coconut caramel bliss vanilla island grill hot grab peaches stone fruit try delicious grilled peaches recipe ppk fell burning ring fire raspberries noticing love things peach stumbled across recipe beyond ecstatic lately husband bbqing everything possibly grilled peaches ginger coconut caramel grilled peaches w ginger coconut caramel grilled fruit grilled peaches ginger coconut caramel isa chandra moskowitz yes email address published required fields marked comment name email website error account postpunkkitchen needs reconnected due recent instagram platform changes instagram account needs reconnected order continue updating reconnect plugin settings page copyright isa chandra moskowitz
Journals & Articles,https://www.marthastewart.com/316040/grilled-peaches,choose fruit fragrant aroma flesh yields bit pressed gently peach cuts tan spots rock hard mushy buy color variety ripeness heat grill medium low halve pit peaches brush sides butter place peaches grill cover grill cook charred softened minutes per side martha stewart may receive compensation click purchase links contained website
Journals & Articles,http://www.peachesncleancarpetcleaning.com/,mobile al251 eastern shore251 foley gulf shores peaches n clean owners cindy richard cox established business june cindy richard years combined experience carpet rug cleaning industry prior starting peaches richard previously top national serviceman previous employment led carryover business trust carpet rugs upholstery anyone peaches n clean carpet cleaning holds prestigious carpet rug tile certifications industry assured receive service second none winner angie list super service award serving mobile spanish fort daphne fairhope foley gulf shores orange beach places mobile al eastern shore foley gulf shores
Journals & Articles,https://www.chobani.com/products/creamy-blended/cup/Peaches%20&%20Cream/,checking box agree least years age
Journals & Articles,https://www.eventbrite.com/e/peaches-and-creamallman-bros-clapton-tribute-postponed-to-may-9-2020-tickets-90455718489,may09sat may pm pm edt add calendar sport kings gulfstream park901 south federal highway 2nd floor hallandale beach fl view map view map refundspostponed may due current corona virus situation decided postpone event may 9th tickets valid new date need anything stay healthy see may 9thback popular demand peaches cream 70s style concert performed two south florida based bands deliver accurate thoughtful renditions music created allman brothers band eric clapton allman brothers band eat peach clapton cream night timeless hits three decades music rock roll hall fame legends conclusion show veteran musicians join together stage perform songs artists wigs fake english southern accents straightforward electric guitars driving rhythmic grooves bluesy vocals trademarks allman brothers band eric clapton best enjoy incredible concert inside beautiful sport kings theater choice reserved tables theater style seating available get tickets still support live music united states events florida events things hallandale beach fl hallandale beach performances hallandale beach music performances sat may pm pm edt add calendar sport kings gulfstream park901 south federal highway 2nd floor hallandale beach fl view map view map refunds south federal highway 2nd floor hallandale beach fl eventbrite email seen event organizer find privacy protected events social allow facebook friends see upcoming events
Journals & Articles,https://nekoatsume.fandom.com/wiki/Peaches,peaches kur mu san cream san regular cat neko atsume peaches extremely hard attract popular among players
Journals & Articles,https://treehorncider.com/pages/peaches-en-regalia,5000info comcontactless online orders https treehorncider square site juicy peach peak summer makes every day heat worth pairing fragrant sweetness peaches balanced acidity tartness apple perfect way celebrate sunshine long days warm summer nights peaches en regalia fermented apple juice mixed locally sourced peach puree maximize taste summer georgia peaches en regalia pairs beautifully fresh acidic saladswith peach season georgia running mid may mid august one available limited time order get peaches en regalia late summer months got get hands season peak local peaches puree start fermenting right away goal two big batches per year remember gone gone next summer load ciders hand crafted nature product natural variation peach apple crops lead small differences flavor year year embrace variation part commitment using local ingredients plus fun spirit discussions year batches best flavor profile keep date treehorn cider news events treehorn cider website phase1 powered shopify use popup embed mailing list sign form alternatively use simple call action link product page clicking red button verifying old enough consume alcoholic beverages
