cluster_no,link,content
Journals & Articles,https://www.medicalnewstoday.com/articles/274620,peaches fuzzy fruit native northwest china member stone fruit family means flesh surrounds one large middle seed inner flesh peach ranges color white yellow orange two different varieties peach freestone clingstone names indicate whether flesh sticks inner seed easily comes apart article look possible health benefits peaches nutritional profile include diet peaches contain significant amount nutrient however cup diced peach provides milligrams mg vitamin c well contributing recommended daily allowance rda potassium fiber iron amount vitamin c equates rda adult male rda adult female according guidelines united states department agriculture usda despite relatively low nutrient profile peaches still benefit people health part balanced diet includes many fruits vegetables peaches add sweetness desserts treats replacing harmful added sugars peaches provide significant amount vitamin c vitamin powerful antioxidant help prevent formation free radicals compounds links cancer development result adequate vitamin c intake may help person reduce risk cancer however exposure risk factors smoking increases amount vitamin c person needs significant effect cancer risk find benefits vitamin c overall health research suggests regularly consuming vitamin c improve appearance health skin powerful antioxidant plays vital role forming collagen collagen acts support system skin promoting wound healing enhancing skin strength review studies found supplementing vitamin c diet improved least one factor actual perceived skin appearance including wrinkling elasticity roughness coloring cup diced peaches contains g fiber usda recommend g per day female adults g day male adults meaning serving size provide least person recommended daily fiber intake fiber rich foods provide range important health benefits according review protect health colon support weight management long term basis reduce risk several harmful health conditions health conditions include cardiovascular disease type diabetes several cancers including colorectal cancer lung cancer person could significantly boost fiber intake replacing sweet low fiber treats peach two every day benefits consuming fruits vegetables considerable plant food consumption increases risk many lifestyle related diseases including obesity diabetes heart disease reduces diet containing plenty fruits vegetables also reduce risk overall mortality learn powerful benefits fiber potassium essential electrolyte helps cells function also help reduce risk high blood pressure stroke kidney stones according office dietary supplements ods cup diced peach provides mg potassium recommended mg daily intake adults peaches among top dietary sources potassium however still play role helping person manage risk chronic disease part healthful diet plan iron vital component hemoglobin helps blood transport oxygen throughout body without enough hemoglobin person might experience iron deficiency anemia according american society hematology lead severe fatigue pale skin shortness breath among symptoms cup diced peach provides mg iron accounts least adult daily iron requirement depending age sex peaches alone provide enough iron keep iron deficiency anemia bay however people include diet alongside foods contain iron raisins cashew nuts spinach read iron deficiency anemia prevent one cup diced peach g provides peaches also provide trace amounts vitamins e k well magnesium phosphorus peaches season summer time freshest flavor nutritional value best choose peaches taut fuzzy skin gives pressure slightly ripen peaches place paper bag near windowsill plenty sunlight buying canned peaches people avoid much syrup look varieties added sugars ideas including peaches diet although peach far superfood play important role health part healthful balanced diet although naturally low calories fresh fruits vegetables contain varying amounts carbohydrates article learn low eating variety fruits important fruits better others people diabetes fresh frozen fruits better despite online claims best time day eat fruit however people time fruit intake help weight loss managing fruits healthful stand exceptional nutritional values article look best fruits people fruit contains natural sugar although natural sugar good health important remember consuming fruit juices canned fruit
Journals & Articles,http://www.peachesnorthconway.com/,peach family owned operated restaurant north conway nh dedicated serving creative quality dishes invite join us scrumptious breakfast lunch hope feel right home please join us casual family friendly dining days week 8am 30pm closed tuesdays proud serving frontside coffee roasters light dark roast coffee voted top breakfast spot nh msn com hours open days week 8am 30pm closed tuesdays sat sun 7am 30pm serving breakfast day long gluten free options available gift certificates give us call call us home us menu photo gallery contact us find us mobile sitewebsite design webmaintain
Journals & Articles,https://peachesskincare.com/,peaches focuses helping achieve perfect skin subscribe belief multiple treatments products methods required achieve perfect complexion mind offer one one facial highly effective every skin type condition step facial every ingredient natural products hand selected efficacy treating healing skin naturally regardless skin condition severity introducing peaches regiment deliver quality results last lifetime belief simple peels lasers injectables pills foundation non invasive procedures skin largest organ visible part body help make beautiful combination facials products peaches skin care line naturally derived antioxidant focused program gives skin nutrients craves work healing skin giving glowing skin tone make luxury skin care attainable every person salon locationseach peaches location representation community salons reflect business importantly reflect try people communities around business become like families see daily basis ask around hard pressed find someone familiar least one staff long beach ca cincinnati oh peaches salons incredibly involved community well businesses surround two locations salons impeccably designed comfortable inviting clients come visit us see peaches difference californiaestablished mid peaches long beach peaches naples call grown long beach premier natural skin care facial salon easily located vibrant pink door michael pizzeria ruth waters fine fashions californiawhere started peaches santa barbara location became go natural facial skin care salon began present day conveniently located directly state street intersection arrellaga ohiopeaches skin care made debut cincinnati ohio july thrived ever since recently upgraded location prominent building located intersection cooper montgomery rd come experience cincinnati premier natural skin care facial salon peaches products specifically crafted use facial well home product rigorously tested crafted ensure highest quality naturally derived ingredients make bottles skin care line find grapefruit blueberry coffee pure vitamin many easily recognizable ingredients find however harmful preservatives acids synthetic colors fillers chemicals best antioxidants make salons onto face testimonials ever since started receiving regular treatments facials microdermabrasion microcurrent following recommendations home care skin improved dramatically smoother texture less scarring hyperpigmentation hardly breakout seen particularly telling leave home without wearing foundation except sunblock slight sweep powder e lisa team caring motivational people met facials relaxing time could ask sitting reading sure want invest money peaches urge seriously promise disappointed girl tried absolutely everything lowest lows appearance actually looking mirror feeling gorgeous please search skin care maintenance natural beauty ends grateful introduced peaches santa barbara location years ago particularly excited new naples location cuts travel half allows make regular visits owner lisa staff welcoming efficient yet thorough possess strong attention detail work product line exemplary delivering helpful organic nutrients skin b
Journals & Articles,https://en.wikipedia.org/wiki/Peaches_(musician),merrill nisker born november better known stage name peaches canadian musician producer director visual artist performance artist born ontario jewish family peaches began musical career 1990s part folk trio mermaid cafe established rock band shit year also released first solo album fancypants hoodlum moving berlin germany signed kitty yo label released second album teaches peaches touring opening act bands like marilyn manson queens stone age subsequently released third album fatherfucker peaches songs featured movies mean girls waiting jackass number two little eye drive angry lost translation music also featured television shows lost girl l word ugly betty south park skam tv series handmaid tale rock true blood full frontal samantha bee letterkenny used promotion dirt peaches performed guest vocals pink album try song oh god chicks speed album cents song play guitars christina aguilera album bionic song girls produced co written le tigre major lazer album free universe song scare featuring timberlee born merrill nisker toronto ontario attended private jewish school nisker class clown particularly smart interested creative performance stuff turned difficult structured told kitty empire observer nisker family culturally jewish though religious maternal grandparents immigrated canada ustrzyki dolne poland paternal grandparents galicia ukraine interview urb magazine recounted growing experienced antisemitism walks home school students nearby catholic school would throw stones call dirty jew peaches bisexual early 1990s nisker part folk trio mermaid cafe name taken joni mitchell song carey later released first solo album fancypants hoodlum name merrill nisker subsequently developed style persona would take international fame peaches started shit noisy four piece combo chilly gonzales k jason beck bassist sticky later weeping tile music maul dominique salole k mocky absurd highly sexual rock music harbinger nisker would become time adopted peaches name peaches moniker taken nina simone song four women simone screams end name peaches toronto rising fame lived come fellow recording artist feist feist worked back stage peaches shows using sock puppet calling themself bitch lap lap two also toured together england staying justine frischmann elastica went video document peaches us tour made clothes musician peaches inspired use roland mc compositions creating six track ep lovertits peaches moved berlin germany visiting old friend jason beck enjoying modest european success chilly gonzales new home base berlin peaches landed one night gig merits show alone berlin kitty yo label signed spot label offered chance record new album teaches peaches back home toronto already completed lovertits ep released summer full length album teaches peaches released fall peaches appeared british tv show top pops performance deemed racy aired nisker signed european contract sony following release teaches peaches later made big budget video song set sat locker room pubic armpit hair grew rapunzel length sony subsequently dropped want money back peaches said nisker 34aa bust one first female busts cast famous 1960s groupie cynthia plaster caster better known making molds male rockers genitalia peaches appeared hideous man short film directed john malkovich short created showcase clothing designed bella freud featured poetry gary sinise peaches released second album fatherfucker xl kitty yo years touring opening artists like marilyn manson queens stone age wrote programmed album music single kick features iggy pop described peaches rolling stone rock n roll sex album fatherfucker peaches nominated outstanding music artist category 15th glaad media awards along rufus wainwright meshell ndegeocello junior senior bitch animal lost wainwright third album impeach bush peaches enlisted guest musicians joan jett greg kurstin josh homme samantha maloney beth ditto feist dave catching brian connor radio sloan perform several tracks herms short hermaphrodites formed spring peaches live backing band played small large venues sex sex related themes shock factor audience citation needed herms also reference 1970s duo peaches herb blending words peaches herms opening act nine inch nails bauhaus second half summer u tour august peaches posed anti seal culling advertisement campaign created people ethical treatment animals peta called fur dead advertisement featured image peaches juxtaposed image baby seal clubbed words canada club scene sucks printed image peaches peaches posed model advertisement vestal watches company advertisement shown fader magazine peaches nominated album impeach bush category outstanding music artist 18th glaad media awards along ditty bops owen pallett pet shop boys scissor sisters lost scissor sisters peaches played live parklife festival australia fall german band sweet machine song boys wan na theme song tbs series full frontal samantha bee peaches fourth album feel cream released may europe may north america first single album double side talk peaches enlisted contemporaries co produce number tracks including simian mobile disco soulwax digitalism shapemod long time friend collaborator gonzales co wrote songs feel cream shunda k voice yo majesty featured track billionaire peaches noted stage costumes flamboyant sense style looks often nostalgic futuristic aggressive glamorous push limits gender identity peaches band sweet machine wear costumes variety designers notably works closely stylist designer vaughan alexander celebrity hairstylist charlie le mindu young american fashion designer john renaud peaches backing band sweet machine toured australia performing sold big day festivals series sideshows peaches supported tour shunda k performed collaboration billionaire bdo festivals sideshows also opening act sideshows along evil beaver melbourne citation needed march peaches electronic artist year award 10th annual independent music awards held toronto canada march copyright owners musical jesus christ superstar denied peaches permission perform one woman version planning stage berlin receiving attention several media outlets peaches successfully negotiated rights holders musical performed march berlin hau1 gonzales accompanied peaches piano travis jeppesen stated review artforum peaches set managed surprise us showing expansive vocal range musician natural sensitivity dynamics andrew lloyd webber score emotive prowess rarely ever displayed less holy music peaches appeared film called ivory tower also includes spots feist chilly gonzales tiga gonzales mother peaches stars marsha performance artist engaged man named thaddeus tiga things get complicated ex hershall gonzales comes back life movie set toronto shot days late winter early spring co written gonzales c line sciamma directed wrote water lilies directed adam traynor produced nicolas kazarnia ivory tower given limited theatrical release august may christina aguilera announced peaches among collaborators fourth studio album bionic peaches featured track called girls song co written produced le tigre august peaches released new single titled jonny single part tribute series alan vega band suicide musicians released tribute singles part series include horrors primal scream klaxons bruce springsteen peaches also appears guest musician r e release collapse contributing vocals song alligator aviator autopilot antimatter peaches song boys wan na featured online teaser live action feature film bad kids go hell based best selling graphic novel name also serves theme music late night television series full frontal samantha bee also featured episode orphan black announced semi biographical musical concert film would premi red toronto film festival utilising songs peaches back catalog backed band sweet machine peaches premiered toronto international film festival september october peaches released new single burst digital single backed several remixes photographer holger talinski collaborated peaches book photographs else teaches peaches released june book published akashic books also includes text written peaches r e lead singer michael stipe artist singer yoko ono actress ellen page peaches sixth studio album rub released september produced vice cooler peaches los angeles garage june announced contain guest vocal appearances kim gordon feist simonne jones unused track rub sessions titled bodyline released adult swim july vice cooler produced track features nick zinner guitar described heavy chugging guitar line peaches half raps half sings high octane space jam may peaches appeared fourth season episode canadian tv series orphan black performing bodyline club performed boys wan na white house correspondents dinner april february peaches made debut staatstheater stuttgart performing anna kurt weill die sieben tods nden peaches opened first institutional solo art exhibition whose jizz kunstverein hamburg august october taking bold unexpected approach topics sex feminism queerness gender new millennium politics peaches calls wjit presentation deconstructed musical scenes heart presentation fleshies renamed rewrite narrative break away humans human interactions away words like sex toys masturbators quest find sexual equality amongst gender identity one theme peaches music often playing traditional notions gender roles representation lyrics live shows consciously blur distinction male female example appears cover album fatherfucker full beard asked chosen title shock value commented call mothers motherfuckers stub toe say aww motherfucker motherfucker use everyday language insanely intense word one shy away obscene terms actually mainstream motherfucker mainstream word going use motherfucker use fatherfucker trying even disputes accusations penis envy preferring term hermaphrodite envy since much male female us age another theme peaches music recent years lyrics several songs album feel cream tackle issue age including trick treat lick crow feet show stopper never mind age like breaking cage mommy complex peaches criticized ageism directed telling new york daily news going make aging cool peaches lists john waters cindy sherman paul mccarthy films tron grease liquid sky phantom paradise inspiration visuals live shows
Journals & Articles,https://www.peachesboutique.com/,0102free ground shipping easy exchanges returns find lower price match peaches boutique chicago dress retailerin peaches boutique started mom pop store featuring women designer clothing mid narrowed focus designer dresses peaches boutique runs one top dress stores chicago well popular retail website store brick mortar store square feet housing dresses time features fitting rooms brand stocks top designer dresses like sherri hill jovani mori lee every size 32w read peaches chicagoland storefront online store browse different styles vary price color designer fast shipping stock items shipped next business day worldwide price matching offer price matching full priced dresses learn dress details current trends browsing designer unique prom dress collections entering email address agree receive peaches boutique offers promotions special messages may unsubscribe time dress phones open 9am fif coming store please print list bring store list print pictures counter peaches
Journals & Articles,https://www.youtube.com/watch?v=wvAnQqVJ3XQ,loading loading loading working loading loading working sign report inappropriate content loading loading music video famous song peaches everyone information guys still around hunt albums wont disappointed loading loading loading loading loading working loading playlists
Journals & Articles,http://www.bcrestaurantgroup.com/peaches,chicken roasted seasonal vegetablespeaches classic american restaurant nod south nestled stuyvesant heights historic brownstone neighborhood brooklyn peaches features contemporary southern menu setting comfortable grandmother dining room service welcoming hospitality commitment farmers local merchants heart culinary spirit evident simple preparations detailed attention gently updated classics lewis avenue brooklyn ny peachesbrooklyn com
Miscellaneous,https://open.spotify.com/artist/1gkSl4XpHIHI4I1WQbfXOE,partners use cookies personalize experience show ads based interests measurement analytics purposes using website services agree use cookies described cookie policy browser support spotify web player switch browsers download spotify desktop listen peaches full spotify applegalprivacycookiesabout adslisten favourite artists device free try premium trial
Journals & Articles,http://www.peacheschrist.com/,please install upgrade flash turn javascript
Miscellaneous,https://www.peachesrecordsandtapes.com/,copyright peaches records powered shopify
Journals & Articles,https://twitter.com/peaches?lang=en,detected javascript disabled browser would like proceed legacy twitter yesinfo tix https linktr ee peachesnisker sure want view tweets viewing tweets unblock tbt peachesnisker teachesofpeaches impeachmybush coachella coachella2007pic twitter com v9ui0f0ovtpeaches period felix h gel bassler teachesofpeaches peachesnisker theresonlyonepeach berlinartistpic twitter com gjuvl2nigiback time worked together celebrated together pushed boundaries together cunt wait next level stay inside go inside stay calm love https www instagram com p b xud6hlnba igshid 1t66vfwm9v0zm need healthy masculinity represented way intersectional feminism queer culture going accept help nurture thespeechissue https bit ly 2tx2ucr pic twitter com tc5qynwzorrest power hal willner proof game make rules always brought creativity community together whole new level true risk taker gives fucks https www instagram com p b udtfnfw3v igshid gi80phx38age new date iii points miami oct sale http iiipoints com iiipoints teachesofpeaches miamipic twitter com ko8lkydb7v info tix https linktr ee peachesnisker info tix https linktr ee peachesnisker info tix https linktr ee peachesnisker info tix https linktr ee peachesnisker info tix https linktr ee peachesnisker insanity let http www playboy com read peaches makeup hair styling movement ryan walker page playboy thespeechissue teachesofpeaches whosejizzisthis wjit fleshiesthe devil sure knows make grand entrance weill seven deadly sins peaches seven heavenly sins ballet vocals kurt weill texts bertolt brecht live testimonial peaches round begins tomorrow stuttgart link bio forpic twitter com xngwhktul3 tickets sale http j mp 2oqfxcb pic twitter com nvc0fbxmkkpeaches retweeted meltdown festival announced june tix sale members wed feb general public fri feb https twitter com meltdownfest status peaches added peaches retweeted bz berlin b z honored one year bzkulturpreis recipients bzkulturpreis2020https twitter com bzberlin status peaches added low ticket alertthere one peach hole middle shows sold dec limited tix avail 6pm perf dec 31st come start nye us setitoff https www volksbuehne berlin de programm peaches one peach hole middle pic twitter com rurtlwraoqdecember food issue go get find year culinary trends best museum caf city foodie insta gurus newsstands https www exberliner com features december issue ready first ever internationalmusicawards live stream beings 00pm cet europe https www magenta musik de magenta tv international music award timeforima ima2019 imaberlinpic twitter com gqsud0zqj73 transgender americans killed since victims gun homicides majority victims black women today remember lives fight disarmhate transgender people live free threat gun violence tdorpic twitter com lwokb4bdodpeaches retweeted rolling stoneperforming first ever international music awards november 22nd berlin ima2019 timeforima teachesofpeacheshttps twitter com rollingstonede status peaches added issue interviews albums new music event listings month speak berlin plus ofthenorth tons inside streets read online http bit ly bis peaches pic twitter com seg6xrznvrmuseums brings fleshies together http bit ly 2bqizim peaches exhibited first animatronic singing sex toys museum whose jizz closed bet questions pic twitter com iqzrkat1t8when festival needs dose loudness lewdness call get ready dance ugly pants take back big day sets live wireless http ab co 2p5lq1o pic twitter com ll0utcroassurprise join taylor mac decade history popular music iconic feminist musician performer one special guests join chapter show saturday tickets https bit ly 2lp4jad taylormac twitter com oouzjvxu5o tweeted yet back top twitter may capacity experiencing momentary hiccup try visit twitter status information add location information tweets city precise location web via third party applications always option delete tweet location history learn url tweet copy easily share friends add tweet website copying code learn moreadd video website copying code learn morehmm problem reaching server try embedding twitter content website app agreeing twitter developer agreement developer policy timeline spend time getting instant updates matters hover profile pic click following button unfollow account see tweet love tap heart lets person wrote know shared love fastest way share someone else tweet followers retweet tap icon send instantly add thoughts tweet reply find topic passionate jump right get instant insight people talking follow accounts get instant updates topics care see latest conversations topic instantly catch instantly best stories happening unfold
